Topic,Words,Frequency,Timestamp
79,"daddy, jjb1ylvkot, 7jlw8t3n2b, cn44luv0rs, jm6hm98ogc",8,2023-04-27
80,"bath, bathe, bathed, bpppz7cynm, nnhgazysnd",9,2023-04-27
81,"oreo, oreos, cookies, watering, weighing",4,2023-04-27
82,"mate, argentinian, usurious, hold, debts",3,2023-04-27
83,"churros, dulce, de, leche, some",18,2023-04-27
84,"much, xszvixujuj, 8q9fvyfium, frasesparaligartealapersonaquetegusta, duqzq1njv1",8,2023-04-27
85,"jkjjjkj, jsjjsjs, espertists, uajajaj, 5ecnsrghnw",9,2023-04-27
86,"strawberry, milkshake, diosmio, lulo, harvest",5,2023-04-27
87,"breakfast, 0rjuhax6ps, 0znmhqwmk3, wfkgbiitdc, sc6p4p4adf",8,2023-04-27
88,"lpm, bad, chabonnnnn, what, piss",7,2023-04-27
89,"smell, smells, qkijbujcki, 69rvdngjyr, h9qeolktna",8,2023-04-27
90,"rt, lik, if, give, see",12,2023-04-27
91,"hauunpinfb, siren, sirens, drink, from",2,2023-04-27
92,"soy, lhrblulivq, duquesita, plasticized, convenient",3,2023-04-27
93,"delicious, preñaito, 55aaqdhqwn, os8hhuva7o, i36vafzogz",11,2023-04-27
94,"bb, kisses, wherever, mommy, favorite",9,2023-04-27
95,"cheese, artisanal, guarner, violeta, products",4,2023-04-27
96,"bed, sleep, mlmgtn49us, glass, homework",5,2023-04-27
97,"bread, y2mns6yhsy, 1bmxrm6uh2, patys, xfi",3,2023-04-27
98,"eggs, e95vbduvd6, fcmcdqfltb, coya5juher, lkdeammcit",3,2023-04-27
99,"yogurt, sachet, pordio, unwhipped, rvs09iup4c",6,2023-04-27
100,"bread, dulce, de, butter, zjibux6hnd",5,2023-04-27
101,"peiro, marcos, hijosdeldesierto, pngqk53l0g, kkma7uabef",3,2023-04-27
102,"cold, alone, m9bcaserfb, hwq0inyulk, asco",5,2023-04-27
103,"kill, myself, pudding, rice, want",7,2023-04-27
104,"slurries, stabilizers, rubbers, drink, cindor",4,2023-04-27
105,"his, her, he, coincidence, loud",8,2023-04-27
106,"cry, spilled, 4efixbbwt0, kase, bottle",3,2023-04-27
107,"ztzfnvydgx, 7pavegn4bs, draft, drink, flow",3,2023-04-27
108,"rico, bb, tzzezi0xwy, eh2av0dfit, ogrgqtkbh8",6,2023-04-27
109,"yippie, mi, que, la, como",7,2023-04-27
110,"jakdjajs, fetito, chirris, fmqdv5spi3, aunt",5,2023-04-27
111,"lick, licking, bald, waaaaaaaaaaaaaaaaaaaaaaaaaaaaaaa, xmsssssssssssss",8,2023-04-27
112,"frother, amazon, automatic, omqqmjvfqw, asrd4kgpmt",3,2023-04-27
113,"pkuriafwhw, meiajfe6dz, ctdxwor9qj, hot, hello",2,2023-04-27
114,"zszszszszs, jwxs1ognj4, shmc75ecui, mecha, funny",3,2023-04-27
116,"lecche, dame, plcjecvehg, nzeddsyedv, boot",2,2023-04-27
117,"blackout, expired, expire, charged, probably",2,2023-04-27
118,"tiger, canchita, chili, pepper, preparation",3,2023-04-27
119,"cuckold, wife, cxjpcplzqx, her, eukewtqxjb",5,2023-04-27
120,"açaí, shaken, açai, an, belem",9,2023-04-27
121,"cappuccino, lactose, evaluating, mocha, struggling",2,2023-04-27
123,"poop, pooping, mipeque, eomfmloomm, t3by3vzgup",7,2023-04-27
124,"banana, broder, bufff, bananas, busted",4,2023-04-27
-1,"milk, to, and, co, https",1744,2023-04-28
0,"of, the, in, production, price",174,2023-04-28
1,"coffee, with, milk, and, morning",128,2023-04-28
2,"pudding, rice, made, 70g, pi",71,2023-04-28
3,"healthy, lifestyle, diet, health, life",100,2023-04-28
4,"bad, people, have, what, milk",71,2023-04-28
5,"hit, crashed, car, head, had",56,2023-04-28
6,"bad, he, madrid, maratea, the",32,2023-04-28
7,"latte, matcha, croissants, cold, order",51,2023-04-28
8,"breast, babies, donate, donation, frascotón",31,2023-04-28
9,"asturian, asturias, the, asturiana, of",51,2023-04-28
10,"penalty, beaten, goalkeeper, badly, taken",38,2023-04-28
11,"gay, cum, cock, cocktribute, porn",40,2023-04-28
12,"beat, beats, nothing, up, beaten",36,2023-04-28
13,"lactose, free, intolerant, intolerance, stomach",45,2023-04-28
14,"chocolate, fresh, vanilla, milk, shopping",23,2023-04-28
15,"cereal, first, cereals, then, btrwaves",31,2023-04-28
16,"almond, coffee, bought, vanilla, milk",25,2023-04-28
17,"cock, dick, suck, my, penis",30,2023-04-28
18,"video, videos, full, rt, upload",29,2023-04-28
19,"pump, pumping, who, someone, pumped",29,2023-04-28
20,"milkshake, aesthetic, chocolate, myself, today",34,2023-04-28
21,"people, bad, person, are, rude",25,2023-04-28
22,"he, him, his, escapes, has",20,2023-04-28
23,"condensed, strawberries, ingredients, grams, cream",24,2023-04-28
24,"want, gqtcjcdl71, romzkivior, e0itt2zizl, xn24a4xkei",13,2023-04-28
25,"cockroach, rule, scientists, joking, science",24,2023-04-28
26,"shaken, shake, unnoticed, shaking, going",25,2023-04-28
27,"physical, change, triton, bardem, zack",15,2023-04-28
28,"shake, protein, herbalife, ryang, gym",26,2023-04-28
29,"cow, calf, vegan, vegans, calves",14,2023-04-28
30,"dulce, de, leche, cuyo9ehnxn, lxslghujez",18,2023-04-28
31,"painted, as, cow, bad, j06labglwm",14,2023-04-28
32,"baby, father, crises, mom, son",24,2023-04-28
33,"mala, mapuche, leche, mexicali, uabc",13,2023-04-28
34,"ass, fill, hqask4xgnr, fepsu3s, gssprgw12i",9,2023-04-28
35,"sisters, brother, tuzak, brothers, ownxldlnqu",12,2023-04-28
36,"leche, bursary, llena, applications, oso",22,2023-04-28
37,"her, she, nail, äri, gämeplays",11,2023-04-28
38,"ice, cream, dulce, de, leche",21,2023-04-28
39,"dulce, de, leche, 3io0fd51kq, klbtqr7o0m",13,2023-04-28
40,"amazon, skin, remover, canarian, ml",9,2023-04-28
41,"physical, change, mental, perseverance, emotional",17,2023-04-28
42,"record, broken, broke, escalada, records",13,2023-04-28
43,"rich, how, ass, 70ciber, out",20,2023-04-28
44,"cake, dulce, de, leche, cakes",15,2023-04-28
45,"con, café, cafe, leche, frío",9,2023-04-28
46,"face, mouth, fill, on, want",16,2023-04-28
47,"fill, fills, filled, with, cola",15,2023-04-28
48,"powdered, 8crvtrew0p, tgzvrowsgi, mx6xseke11, 48uphew32e",11,2023-04-28
49,"telegram, channel, myxkk6fki1, content, full",16,2023-04-28
50,"oat, oatmeal, chia, tbsp, oats",6,2023-04-28
51,"he, his, him, her, coffee",14,2023-04-28
52,"ktgympb4vi, wmb6beh1cd, mbbqlf8xok, kqaikvmnzg, pringuitos",6,2023-04-28
53,"out, get, umcumtiar6, v6hiamyaxv, jconj5ek6z",15,2023-04-28
54,"hooker, her, hookers, little, saying",13,2023-04-28
55,"tea, teapot, hblymkt9ol, placerrrr, angelssbecky",15,2023-04-28
56,"pancakes, dulce, de, leche, pancake",12,2023-04-28
57,"paddling, dulce, de, leche, rowing",15,2023-04-28
58,"cat, kitten, cats, kittens, thirsty",10,2023-04-28
59,"tank, pj4hoffrvy, swvefqpgg7, ctguwimuid, comparing",6,2023-04-28
60,"as, really, say, cow, bad",17,2023-04-28
62,"birthday, lots, your, on, masilvera27",9,2023-04-28
63,"white, brunette, blonde, krrsru04cv, mesista",5,2023-04-28
64,"friday, morning, s5i5suqecg, lzcbg1egvq, 3qds82pqzs",10,2023-04-28
65,"teeth, baby, tooth, removed, belgians",8,2023-04-28
66,"tits, ich4xjepbl, u2hkslfdgc, jdntjtovna, gy43shfybn",12,2023-04-28
67,"smoothie, banana, fruit, smoothies, strawberries",14,2023-04-28
68,"strawberry, 2n5dafmy1k, zmibyturnj, fj7cpwxojg, txnrlarima",8,2023-04-28
69,"dulce, de, leche, spoonful, spoonfuls",9,2023-04-28
70,"mood, bad, t4wfnbwnlq, aqpqgy8fye, u1usgboq6o",9,2023-04-28
71,"cookies, 6km9rzcpre, dr0cdz6puv, nnnn, lincoln",7,2023-04-28
72,"arroz, con, dont, wanna, rn",2,2023-04-28
74,"coconut, milliliters, sugar, syrup, bw43gzadsl",10,2023-04-28
75,"egg, quinoa, pancakes, oatmeal, gineva",7,2023-04-28
76,"croissants, coffee, lxl7fx7w5l, croissant, lrpm",6,2023-04-28
77,"tweet, twitter, october, tweets, zzosoxknp2",6,2023-04-28
78,"swallow, swallowing, dogs, 3xfofnd8xc, rt6hj07sqr",9,2023-04-28
79,"daddy, qgnr3yolrd, ncbihgsiow, 4hh6g4hcrq, gksdbvusnu",8,2023-04-28
80,"bath, bathe, jzu83jksdx, k0pguuext2, viernesdemamadas",7,2023-04-28
81,"oreo, oreos, zenzoo, 1uw4k1chb6, oreooo",7,2023-04-28
82,"argentinian, dulce, argentina, de, leche",8,2023-04-28
83,"churros, dulce, de, churro, taehyung",12,2023-04-28
84,"much, how, per, bv0xp2slxc, 9cqitu7rbz",10,2023-04-28
85,"lelias, jahsja, ashhh, jsakdj, 9uyctsg1lo",5,2023-04-28
86,"milkshake, strawberry, jsdtrkiwim, 8260ctg5q1, cambur",5,2023-04-28
87,"breakfast, ky3q2tn9mm, izauprsqst, tamaulipan, curvyteentnt",3,2023-04-28
89,"smell, smells, q6isdxoils, agenos, jkxhalcjad",5,2023-04-28
90,"rt, 6dwk6nhigq, wcmrcedzpm, bmvscesgjm, zd4fr4da1h",6,2023-04-28
91,"sirens, 4vmaiic45s, melanie, drink, leche",2,2023-04-28
92,"soy, p5rhgifpo0, prohibitive, uty6h1lryp, ppnutpbk93",9,2023-04-28
93,"delicious, v3dbc6zi68, daldefbajk, kh0onq795q, riffs",6,2023-04-28
94,"bb, motomami, loyal, butterfly, kisses",4,2023-04-28
95,"cheeses, venezuela, cheese, produced, used",8,2023-04-28
96,"sleep, btclnmjzpr, bed, glass, before",6,2023-04-28
97,"bread, ndyu44sz2t, crossfit, eternal, reminds",6,2023-04-28
98,"eggs, egg, eemsin3b8l, s19zvxfvv7, au8qod03mj",9,2023-04-28
99,"yogurt, sold, greek, chuyy3c2jv, caprigurt",8,2023-04-28
100,"bread, dulce, de, butter, leche",8,2023-04-28
101,"marcos, julieta, marguery, jsjajss, vsqia2v8kb",5,2023-04-28
102,"glass, cold, isometry, geometriaplanauma, idzaermdkk",5,2023-04-28
103,"kill, myself, pudding, rice, want",1,2023-04-28
104,"drink, intoxicated, 82, shocks, acidity",5,2023-04-28
105,"his, her, he, she, slightly",7,2023-04-28
106,"spilled, over, cry, crying, letrad",6,2023-04-28
107,"drink, jenvnlrbv8, nlm40x1eca, n4t5lzd4om, dgpylkm8oq",7,2023-04-28
108,"rico, ia9swcuucr, hahahahajsjj, 3uuo6ittdy, f7opcwplpo",6,2023-04-28
109,"mi, uoh, jpqdcg7owa, tomh1mahvf, en",8,2023-04-28
110,"mom, bjkdqre00n, peered, hahahahahahahahajja, hahahahajja",5,2023-04-28
111,"licking, lick, msqqde6sqm, sokka, 2tysbvyneb",4,2023-04-28
112,"99, 89u89u8zcv, frother, cm69lup58h, 259",1,2023-04-28
113,"masturbate, hot, 00bvl7nrhq, ynufk6odnn, a3yqcvlbco",6,2023-04-28
114,"plot, rereading, series, potter, magnificent",9,2023-04-28
115,"farumuyr2r, butter, discuss, combination, exists",1,2023-04-28
117,"expired, 3v1pqwjjwh, inflaming, expires, actual",4,2023-04-28
118,"tiger, mwk0hbilav, jord, psgsw1rihb, jtvssh1xxf",7,2023-04-28
119,"cuckold, husbandslave, 8iyf02hcta, cuckoldslave, loserpay",2,2023-04-28
120,"açaí, rogwcbdff4, belém, bonito, pará",2,2023-04-28
121,"cappuccino, 33ijw9bnwy, goey, cielito, shouldn",4,2023-04-28
122,"shawarma, shake, shaken, shawarmalover, resturant",1,2023-04-28
123,"isa, poop, gvfvmyb7ej, conversations, paths",2,2023-04-28
124,"banana, dfszc93zye, toxjiub63w, u0m7haf3xj, completes",2,2023-04-28
-1,"milk, and, https, co, to",1664,2023-04-29
0,"of, the, in, price, farmers",108,2023-04-29
1,"coffee, with, milk, drink, toast",94,2023-04-29
2,"pudding, rice, mom, made, obi",50,2023-04-29
3,"healthy, life, living, lifestyle, diet",65,2023-04-29
4,"bad, people, what, milk, are",77,2023-04-29
5,"hit, car, crashed, head, should",62,2023-04-29
6,"bad, they, vinicius, the, team",58,2023-04-29
7,"latte, order, matcha, lactose, free",51,2023-04-29
8,"breast, baby, breastfeeding, mothers, donation",17,2023-04-29
9,"asturian, federation, asturias, the, valleys",29,2023-04-29
10,"penalty, beaten, goal, corner, hit",36,2023-04-29
11,"gay, cum, cumtribute, cocktribute, horny",36,2023-04-29
12,"beat, beats, nothing, beaten, unnoticed",29,2023-04-29
13,"lactose, free, intolerant, stomach, whole",33,2023-04-29
14,"chocolate, vanilla, fresh, choro, soprole",23,2023-04-29
15,"cereal, cereals, first, or, then",24,2023-04-29
16,"almond, almonds, neta, 0yhlmhjsrv, moirigoyenh",20,2023-04-29
17,"cock, dick, suck, my, penis",44,2023-04-29
18,"video, videos, rt, onlyfans, see",21,2023-04-29
19,"pump, pumping, who, cuautla, morelos",24,2023-04-29
20,"milkshake, athletes, miracle, aiacadsci8, mamei",29,2023-04-29
21,"people, bad, are, you, envious",22,2023-04-29
22,"he, his, him, subway, surely",18,2023-04-29
23,"condensed, s8wuher1jf, strawberries, chantilly, slushies",19,2023-04-29
24,"wants, want, give, who, https",22,2023-04-29
25,"cockroach, rule, scientists, joking, science",38,2023-04-29
26,"shaken, unnoticed, shake, not, kkkkk",21,2023-04-29
27,"physical, change, fanny, fuentes, honduran",18,2023-04-29
28,"shake, protein, fatigue, creatine, muscle",12,2023-04-29
29,"cow, vegans, cows, animals, indoctrinating",13,2023-04-29
30,"dulce, sl37ec5b8a, miguegranados, m9gduczyto, sy3mrxl2jp",5,2023-04-29
31,"painted, as, cow, bad, is",18,2023-04-29
32,"baby, father, breast, mom, viruses",19,2023-04-29
33,"mala, leche, hmmmm, la, puta",19,2023-04-29
34,"ass, fill, your, my, want",19,2023-04-29
35,"sisters, brothers, brother, sister, scene",25,2023-04-29
36,"leche, mi, metegol, vkln1qxm9y, mxnzu1jzpq",19,2023-04-29
37,"her, she, adorable, pgffbiixpa, cr7pfqcnip",14,2023-04-29
38,"ice, cream, dulce, de, leche",12,2023-04-29
39,"dulce, de, leche, co, https",28,2023-04-29
40,"price, amazon, kg, link, solar",12,2023-04-29
41,"physical, change, hall, vntxqxevgj, zcfozn3fgd",9,2023-04-29
42,"record, broken, broke, records, kickstarter",20,2023-04-29
43,"rich, suck, 0nndnnrwru, mmmmsiiii, alpoqudzgi",8,2023-04-29
44,"cake, dulce, peach, de, leche",8,2023-04-29
45,"con, café, cafe, leche, k6haylqwsg",13,2023-04-29
46,"face, fill, mouth, h3s7agqkpk, 5oowxvmwzh",10,2023-04-29
47,"fill, filled, tlchbzzznz, iqrvieqgdf, srjhhj93fs",11,2023-04-29
48,"powdered, klim, g6uthogvwc, offff, deay",13,2023-04-29
49,"telegram, channel, dm, link, encuentrogaymty",15,2023-04-29
50,"oat, oatmeal, froiz, oats, constipation",4,2023-04-29
51,"57, he, 29, kakakakak, wkymvbd16s",5,2023-04-29
52,"t8xnglcuo7, qjggjddncm, e1gtgzg4fk, ayatogalilive, urlka62tip",12,2023-04-29
53,"out, get, click, clng3cq4to, ddddd",11,2023-04-29
54,"hooker, hookers, dennysvergon23, her, little",14,2023-04-29
55,"tea, teapot, bmnudijyne, hmmuudmtxz, avjrwg2fej",5,2023-04-29
56,"pancakes, dulce, de, leche, pancake",7,2023-04-29
57,"paddling, dulce, de, leche, paddle",8,2023-04-29
58,"kitten, cat, kittens, cats, upcgpcucus",14,2023-04-29
59,"tank, tanks, makima, cvtxdeyvpo, vehxx80uty",5,2023-04-29
60,"as, really, say, cow, bad",11,2023-04-29
62,"birthday, lots, your, on, bu4khuyv3u",10,2023-04-29
63,"white, whiter, eyes, black, dark",17,2023-04-29
64,"morning, fxypaamo3h, kayx2ow1me, s7xitfuxw1, 2prthlcpzm",9,2023-04-29
65,"teeth, baby, oy5tfeq6rn, tooth, butterflies",4,2023-04-29
66,"tits, them, ud4ca9fblb, rmuz3jgqon, u5e1dqxrlp",11,2023-04-29
67,"smoothie, unroll, mu, fruit, 28xqzzvfdu",7,2023-04-29
68,"strawberry, juice, fugmkkkxfj, o81kowrofx, divinooo",7,2023-04-29
69,"dulce, de, spoonful, leche, eating",6,2023-04-29
70,"mood, bad, fmonqlq5vg, pajaaaaa, bach",7,2023-04-29
71,"cookies, 1zzuqgbcpc, vpwqnemxwg, claus, rush",6,2023-04-29
72,"arroz, con, leche, mexicanricepudding, rpbjecleyd",8,2023-04-29
73,"sugar, glucose, bii5efuve5, rauch, gztj4tjlrt",3,2023-04-29
74,"coconut, refresher, tqm, pill, putting",4,2023-04-29
75,"breakfasts, dough, s7u822e72l, cutters, marinera",3,2023-04-29
76,"croissants, coffee, gviuywwpeq, overpricing, mantk",5,2023-04-29
77,"twitter, tweets, tweet, blocked, unhappy",10,2023-04-29
78,"swallow, caraqueño, nuiwphfo3b, po2h1fku1m, uv0cgsfsjh",9,2023-04-29
79,"daddy, dads, jhfju8q22i, 2213071062, ukstvlchw5",7,2023-04-29
80,"bathe, bathed, bath, hr5ygkcqbs, jqblghrdrj",8,2023-04-29
81,"oreo, oreos, 2gertmzxad, fiveguys_es, michoacana",6,2023-04-29
82,"country, 9jxmoptrj1, tm, argentinian, hate",2,2023-04-29
83,"rhv1i3cilh, churro, jungkook, churros, could",1,2023-04-29
84,"much, dsvobjqkzc, sxatl1zbfb, msf51lxiuh, jakqndmfnsldnd",8,2023-04-29
85,"trashkookers, jaksjak, jim, asjdjdheje, svdsix83ji",6,2023-04-29
86,"strawberry, milkshake, site, lloradita, zyane5n8xs",10,2023-04-29
87,"breakfast, hjvlupftbh, luf23kijxu, wk3xzk6a6o, jqbn75skjs",8,2023-04-29
88,"lpm, lxl, bad, what, drexxan",10,2023-04-29
89,"smell, kid, far, breast, so",1,2023-04-29
90,"rt, give, 0m8jktlcbw, r9sgrpbvir, a6hd4hagct",5,2023-04-29
91,"42njfgop3e, sirens, drink, from, leche",1,2023-04-29
92,"soy, ganges, agoatn5uxn, fed, tasted",3,2023-04-29
93,"delicious, fejzckir2m, qkvlmkrasu, r9wwtehgxo, bcosko0dqu",4,2023-04-29
94,"bb, kisses, mommy, wherever, favorite",13,2023-04-29
95,"cheese, cotija, mushrooms, enveloping, airas",3,2023-04-29
96,"sleep, window, sleepwalkers, reappearance, buildings",2,2023-04-29
97,"bread, kknete7vxv, 20v1npgxel, yeast, kjjj",4,2023-04-29
98,"eggs, fetswuwbsy, q5qpil6fs2, capish, q9lxeghiiy",4,2023-04-29
99,"yogurt, qvkatyv4c4, zymcbfpu4r, carmela, chopped",2,2023-04-29
100,"toast, bread, dulce, de, leche",6,2023-04-29
101,"marcos, gus, romina, vrcsuq9quh, marcosginnochio",5,2023-04-29
102,"ei1ox4oolw, 1trzowrhqm, sensations, cold, inventing",3,2023-04-29
103,"kill, myself, pudding, rice, want",3,2023-04-29
104,"puppies, milkshakes, hate, thank, stop",3,2023-04-29
105,"gnom, his, her, she, ymlpjqeiyw",6,2023-04-29
107,"drink, drinking, alinedollpinto7, cwdfpupd00, lytc6mfjpy",9,2023-04-29
108,"rico, ga6oauke6k, aezu4grvup, flxi28m7ax, htpx6mqgmg",4,2023-04-29
109,"mi, vecino, en, la, el",6,2023-04-29
110,"jet, megustaria, errands, introduced, yerba",3,2023-04-29
111,"licking, lick, 2la0shohze, ou6zplplhq, rmcmma",4,2023-04-29
112,"frother, uaycsx7oph, hdkbpzplsh, bes870, 17490",2,2023-04-29
113,"hot, nwfk6eb3fe, drcqmqawuf, hhloaedhus, qvd2qzdykr",5,2023-04-29
114,"jojo, bpnzvidai6, lxdpor2dvn, invocation, hx6f4tbmxt",4,2023-04-29
115,"qcq4uh4wml, alt, kelly, scent, butter",1,2023-04-29
116,"rgfmhj22v8, lecche, dame, boot, giblets",1,2023-04-29
117,"expired, inexorable, l3xlxlqsbo, expiration, passage",4,2023-04-29
118,"tiger, usjd8kcwi6, hv6de0lpip, chifles, csmre",8,2023-04-29
119,"cuckold, putit0s, nmhfteewtc, 4r2qbt2ekp, cuckgay",4,2023-04-29
120,"açaí, ifmkj0lnbe, i1zji2yz1v, açai, pampered",4,2023-04-29
121,"cappuccino, frapuchatta, flatulently, jv6dtbtrse, yes",4,2023-04-29
123,"poop, sly, sweat, dude, late",3,2023-04-29
124,"banana, b8kv31wkfn, japn25otoj, cheerios, frita",4,2023-04-29
-1,"milk, https, co, and, the",1720,2023-04-30
0,"the, pesos, of, is, in",90,2023-04-30
1,"coffee, with, milk, netflix, myself",88,2023-04-30
2,"pudding, rice, made, mom, grandmother",84,2023-04-30
3,"healthy, lifestyle, diet, health, promote",46,2023-04-30
4,"bad, what, people, have, milk",74,2023-04-30
5,"hit, car, had, crashed, hitting",43,2023-04-30
6,"bad, villa, boca, game, the",88,2023-04-30
7,"latte, matcha, pitcher, mimosas, iced",45,2023-04-30
8,"donate, breast, cuidemosalosniñosyniñas, nutrition, complementary",8,2023-04-30
9,"asturian, siero, barbón, socialist, autonomous",28,2023-04-30
10,"penalty, beaten, corner, goal, hit",60,2023-04-30
11,"gay, pasivo, heterocurioso, rt, tetas",24,2023-04-30
12,"beat, beats, nothing, beaten, up",24,2023-04-30
13,"lactose, free, intolerant, whole, wasn",27,2023-04-30
14,"chocolate, solito, serenito, fresh, vanilla",14,2023-04-30
15,"cereal, cereals, first, then, served",23,2023-04-30
16,"almond, ashta, meddle, don, milk",19,2023-04-30
17,"cock, dick, suck, penis, want",21,2023-04-30
18,"video, videos, rt, onlyfans, see",26,2023-04-30
19,"pump, pumping, pumped, fabcxwktpw, lrg1libnso",18,2023-04-30
20,"milkshake, chocolate, order, sljauybyar, g9zcbrsmo3",23,2023-04-30
21,"people, bad, rude, cmg, how",18,2023-04-30
22,"he, him, his, bflafmsgtb, fyq37olm7h",11,2023-04-30
23,"condensed, dnpnbfasdz, azurquero, gptbejfbxd, axmkjacmpd",18,2023-04-30
24,"wants, want, emanuel_olaiz, u4rigeug8j, 6dxpwoczpt",17,2023-04-30
25,"cockroach, rule, scientists, joking, feed",19,2023-04-30
26,"shaken, shaking, nought, shake, up",14,2023-04-30
27,"physical, change, sibenito, dewey, sullivan",14,2023-04-30
28,"shake, protein, ihbbwvzkhx, n9pxbo414b, chocolata",11,2023-04-30
29,"cows, calcium, cow, natulec, exploiting",13,2023-04-30
30,"dulce, de, leche, granized, frxfrndyqi",18,2023-04-30
31,"painted, as, cow, bad, xwgsfkmneq",12,2023-04-30
32,"emma, baby, tdmps3jhji, hdls, dwd5dnvys5",10,2023-04-30
33,"mala, leche, piovi, cagon, villa",23,2023-04-30
34,"ass, 8mdgttvaao, qaxhrdnfgw, cjevz0osce, jruqrip1eq",11,2023-04-30
35,"brothers, sisters, sister, brother, mncew02fxf",11,2023-04-30
36,"leche, 80shvw5ls6, oypegj6l88, te, la",20,2023-04-30
37,"her, she, gets, 5sqbe61cij, bkbfimkjqj",19,2023-04-30
38,"ice, cream, dulce, de, leche",11,2023-04-30
39,"dulce, de, leche, co, https",302,2023-04-30
40,"miravia, amazon, ecran, ml, chocolate",6,2023-04-30
41,"change, physical, start, achieved, n5lb7bi79h",12,2023-04-30
42,"record, broken, ups, push, views",12,2023-04-30
43,"rich, 7jl87at37j, how, ass, facebook",18,2023-04-30
44,"cake, fried, dulce, cakes, de",14,2023-04-30
45,"con, café, leche, cafe, walazxvboi",8,2023-04-30
46,"jfhpl9djwl, tpvswmyusz, 75xnxziine, rqsiqpntyr, face",5,2023-04-30
47,"fill, filled, n1ydxlkiod, wwpnumgwep, uk4g6coskm",11,2023-04-30
48,"powdered, klim, hddeiazvhe, iqkkuaodey, keso",12,2023-04-30
49,"telegram, channel, encuentrogaymty, group, private",13,2023-04-30
50,"oatmeal, oat, 3srjutkh43, plis, teddy",6,2023-04-30
51,"he, him, his, coffee, some",14,2023-04-30
52,"jaxtmhw915, adkcgclu0s, 6lhbtztnol, kqq511kanl, g2w046vafl",11,2023-04-30
53,"out, get, daiqdlwj0j, ew0oldjc5y, sve75vd0ff",8,2023-04-30
54,"hooker, hookers, little, remil, her",17,2023-04-30
55,"tea, sees, osphxqrbxc, ix03ciayg2, hetknpfzlj",12,2023-04-30
56,"pancakes, dulce, de, leche, some",21,2023-04-30
57,"paddling, dulce, de, leche, toothpick",13,2023-04-30
58,"kitten, cat, kittens, catbabys, yr55r9sal2",9,2023-04-30
59,"tank, tanks, ayyñ, water, uploaded",15,2023-04-30
60,"as, really, say, cow, bad",6,2023-04-30
62,"birthday, lots, birthdayssss, nat, singing",4,2023-04-30
63,"white, whiter, color, rc9ba9pixa, scandinavians",8,2023-04-30
64,"lch9fbhopn, anlijpg9ds, l1t1zpjfc0, sunday, epl",3,2023-04-30
65,"teeth, baby, tooth, rw8gwbz0n1, pledis",6,2023-04-30
66,"tits, follow, ney6pzmkmi, setsi, stephencurry30",7,2023-04-30
67,"smoothie, banana, green, contest, xwaykj3zkh",8,2023-04-30
68,"strawberry, stnfabl9m8, ad7tujsrrn, pallet, pallets",4,2023-04-30
69,"spooning, dulce, retrograde, de, mercury",3,2023-04-30
70,"mood, pg, 6rigwwu3le, 3g81tgmx6f, bad",4,2023-04-30
71,"cookies, seductivesunday, badito, d1hivdnin2, butterbread",8,2023-04-30
72,"arroz, con, arrocito, leche, amp",8,2023-04-30
74,"coconut, slicing, brew, alv, craving",2,2023-04-30
75,"tortilla, potatoes, cream, knkwliwpff, 163kgunlcg",6,2023-04-30
76,"croissants, coffee, q8pasmh3kr, 5kgjkpacfh, bursts",7,2023-04-30
77,"twitter, tweet, tusydq1vnw, pwrd5to2bz, vyrorei",5,2023-04-30
78,"swallow, bark, marsupial, 9fbpwrrqhf, wztxzqowj3",4,2023-04-30
79,"daddy, fgcxie4jdb, y7nlnmjqb9, badge, rasin",5,2023-04-30
80,"bath, bathe, jjeeixark1, 5qh1z9gbju, 4ysvfzfx5n",7,2023-04-30
81,"oreo, oreos, cindor, submarine, nauseous",4,2023-04-30
82,"argentinian, argentina, dulce, de, leche",16,2023-04-30
83,"churros, churro, dulce, de, leche",7,2023-04-30
84,"much, sz35bxt7or, ofebad1ikc, 6nl39y8jd4, babbhxutk8",7,2023-04-30
85,"mgaj52ei5g, wu1mwbxwbm, aksksksjs, jsjsjsjsjsjsjs, jakajs",3,2023-04-30
86,"milkshake, strawberry, ozzy, majesty, burger",8,2023-04-30
87,"breakfast, umye3dzzgh, 6zesal2ext, ak1ydwazt4, 9myqakov7p",6,2023-04-30
88,"lpm, bad, jskajhd, rainting, lpmmm",7,2023-04-30
89,"smell, smells, whiskey, ñarro, rakataca",4,2023-04-30
90,"rt, docwhruuix, dv4o91sccr, ocg2k2mmnt, iweazffuvg",6,2023-04-30
91,"sirens, d9xgslwudy, fn02dwwr9h, sirennnnss, repaint",3,2023-04-30
92,"soy, 3333, mortadella, cam, inflamed",4,2023-04-30
93,"delicious, jhv4g0jqnk, 8v33tlwzdg, gf04voeyqi, n4qxamtmie",5,2023-04-30
94,"bb, wherever, kisses, mommy, favorite",7,2023-04-30
96,"sleep, go, glass, bed, djjh12cbss",7,2023-04-30
97,"bread, ohfwjwc2uy, sfnngy3urm, 43qzkf66zp, jsjss",3,2023-04-30
98,"eggs, zdscgsl2lv, 0heg9a432j, mugaozf37o, pa7xzf3qga",5,2023-04-30
99,"yogurt, tickle, solely, tiktoks, cambur",2,2023-04-30
100,"butter, toast, bread, porn, mate",2,2023-04-30
102,"cold, preservatives, gazpacho, cyz3tz5knw, club",3,2023-04-30
103,"kill, myself, pudding, rice, want",2,2023-04-30
104,"drink, ezz9ol2axr, whole, rumba, depression",5,2023-04-30
105,"his, kiss, her, oenyfuqey4, tofy",5,2023-04-30
106,"spilled, over, cry, crying, fez2rfuyrt",3,2023-04-30
107,"drink, entf8wqg2m, dmfvydgfyh, 2frzozfaxs, leannn",5,2023-04-30
108,"hxqvpknfi8, rico, specialties, clients, stopping",1,2023-04-30
109,"que, uoh, usted, tomh1mahvf, mamacita",5,2023-04-30
110,"quique, dog, had, told, remember",9,2023-04-30
111,"lick, qvvckjjlwr, fgfjxrgi3b, soumise, frenchiescocks",3,2023-04-30
112,"frother, machine, mini, t5syiy0ryv, mllpvtpqsc",2,2023-04-30
113,"hot, hgv1nczw3q, pyhbnnnei7, jiy28azs4r, fiery",4,2023-04-30
114,"movie, damon, plot, book, woodsboro",5,2023-04-30
115,"krispie, butter, treats, hix9i9mees, u4owlooraq",2,2023-04-30
116,"j9f3hmodgk, lecche, dame, boot, giblets",1,2023-04-30
118,"tiger, nf2aqb2ejc, 32jsrqwmd8, 68loumnz93, canchita",3,2023-04-30
119,"cuckold, hotwife, eglvgbanvj, fheklgtrry, nxfq3je3yd",4,2023-04-30
120,"açaí, peach, passion, fruit, banana",2,2023-04-30
121,"cappuccino, acr9nvltx1, nspmu9u4e8, sweetner, jyeajxg1ou",3,2023-04-30
122,"shaken, practice, national, remember, well",1,2023-04-30
123,"poop, gbplcq7wsy, butler, resolved, ankle",2,2023-04-30
124,"banana, tempest, bananas, 230430, ueloq5wtsb",5,2023-04-30
-1,"https, co, the, and, milk",1850,2023-05-01
0,"farmers, puleva, of, the, in",140,2023-05-01
1,"coffee, with, milk, sugar, drink",117,2023-05-01
2,"pudding, rice, made, mom, grandmother",162,2023-05-01
3,"healthy, lifestyle, diet, eating, health",53,2023-05-01
4,"bad, what, people, have, milk",65,2023-05-01
5,"hit, car, head, crashed, hitting",54,2023-05-01
6,"bad, they, soccer, goal, the",35,2023-05-01
7,"latte, matcha, order, ordered, croissants",38,2023-05-01
8,"breast, breastfeeding, donate, herrerayflia, donation",16,2023-05-01
9,"asturian, asturiana, sentydoart, turista, asturias",22,2023-05-01
10,"penalty, beaten, vanderlei, luxemburg, brazilian",25,2023-05-01
11,"gay, cum, akeno, sex, rt",37,2023-05-01
12,"beat, beats, nothing, up, kkkkkk",37,2023-05-01
13,"lactose, free, intolerant, stomach, drink",33,2023-05-01
14,"chocolate, fresh, vanilla, white, choco",24,2023-05-01
15,"cereal, cereals, first, comes, before",36,2023-05-01
16,"almond, milk, tastes, is, ncqlprwwl6",26,2023-05-01
17,"cock, dick, suck, my, want",42,2023-05-01
18,"video, videos, rt, onlyfans, full",25,2023-05-01
