Topic,Words,Frequency,Timestamp
-1,"jbalvin, malumayomellamo, decadence, mundialqatar2022, resident",1,2022-11-17
-1,"mundialqatar2022, ecuador, much, can, so",1,2022-11-20
0,"m1l54jwg4k, mundialqatar2022, canvas, scorer, dirt",1,2022-11-20
82,"bangladesh, messi, worldcupqatar2022, dnxfsyvgf5, tilcara",1,2022-11-28
-1,"argentinapolonia, p3oex7arzd, coloradomufa, qatar2022, mundialqatar2022",1,2022-11-30
6,"momentary, mundialqatar2022, germany, spaniards, costa",1,2022-12-01
10,"copadomundo2022, worldcup2022, ceni, dribbling, rogério",1,2022-12-03
33,"australians, mundialqatar2022, mala, soccer, hate",1,2022-12-03
10,"worldcup2022, croatian, croats, brazilians, neymar",1,2022-12-11
0,"mundial2022, fifaworldcupqatar2022, estamosenlafinal, croacia, j5h3xv54kh",1,2022-12-13
-1,"znrrgxb3bo, vamosaraña, citygroup, vamosargentina, chavofuchs",1,2022-12-15
-1,"argentinacampeon, mundialqatar2022, frustration, resentment, ricotta",1,2022-12-19
-1,"shakira, al, upd2uwh7nq, uuuuggggggggggggg, ysy",2,2023-01-12
-1,"shakira, mayers, maluma, tota, bryan",2,2023-01-13
-1,"shakira, bicoca, oy, renata, guajira",2,2023-01-14
17,"barn, owl, neymar, mmmmm, eyelet",1,2023-01-14
-1,"shakira, horns, choruses, chapuapaolaza, drqmsejcue",2,2023-01-16
-1,"shakira, slutty, u2tngufqty, buenprovechomanabí, amoeba",2,2023-01-17
1,"lomazo, nailed, shakira, roll, fat",1,2023-01-18
-1,"piqué, qfwia8gnpq, ymaxamzf6t, babo, shaggy",2,2023-01-19
-1,"2hl1gsw0ba, pique, shakira, known, boob",1,2023-01-20
18,"boy5nanq4n, shakirabzrp, shortage, shakira, gentlemen",1,2023-01-20
29,"82ok8rooty, billed, cows, every, memes",1,2023-01-20
-1,"shakira, yesthtqudc, ezgakratxa, bagpipe, song",2,2023-01-21
-1,"conlacomidano, jw3twleomf, listeners, sanbenito, poncho",2,2023-01-22
27,"piqué, a8qqkldwot, mjkibntkpl, clara, twingo",2,2023-01-22
-1,"s9800eohjo, redinformativa, listeners, sanbenito, surpassing",1,2023-01-23
27,"chía, gerard, piqué, clara, dating",3,2023-01-23
-1,"piqué, shakira, propagandizing, bomzhw0ygm, spleosrdqu",3,2023-01-24
27,"chía, gerard, piqué, clara, physical",5,2023-01-24
49,"n3q62pk9lr, fzfrgozm7p, telegram, shakira, vip",1,2023-01-24
27,"gili, qehtqjn7v8, chía, gerard, piqué",1,2023-01-25
30,"panicked, shakira, consumed, longer, thank",1,2023-01-25
38,"curled, ice, creamed, cream, freezer",1,2023-01-25
-1,"shakira, rearranged, wither, jhayco, rauw",2,2023-01-26
-1,"shakira, csapvmgnid, 90bzvs5bf7, megahit, riquelmista",2,2023-01-27
-1,"shakira, mathematic, atefczypwq, krwdxlmvsf, breakup",4,2023-01-28
4,"niuls, itchy, overwhelming, archer, ball",1,2023-01-28
-1,"hfxtrqaohe, shakira, chef, juan, jam",1,2023-01-29
0,"colombia, spain, oligarchy, investigations, outraged",1,2023-01-30
10,"nicacio, prior, pique, manu, voting",1,2023-01-30
-1,"uv5jocfrt8, cuckolds, immense, damage, shakira",1,2023-01-31
0,"l6yddzfpfg, colombia, cocaine, shakira, bill",1,2023-01-31
-1,"wz62tabcro, shakira, brazilian, kkkk, pass",1,2023-02-01
5,"u6cb1v2eye, pike, exhaustion, fainted, dps",1,2023-02-01
-1,"go8yihifth, 46, shakira, old, years",1,2023-02-02
27,"zm0nbsvyye, chía, gerard, piqué, dates",1,2023-02-03
-1,"i7aumqubgf, rvczluamn5, humor, shakira, cries",2,2023-02-04
11,"enngie_53, ac8su7xlhq, ramirezdanthe, pornm3xmid, izraelmerino",1,2023-02-06
-1,"sssss, terzolo, venj9krzkh, b6bdm6d9ol, reggaeton",3,2023-02-07
-1,"shakira, vizinho, taa7qpku5v, clwawasjph, hahahajjjjj",3,2023-02-08
11,"f0ftdtijn3, pornm3xmid, izraelmerino, elpajaritodetwt, horchatascdmx",1,2023-02-08
27,"o8fll8tn9a, chía, unrecognizable, dating, piqué",1,2023-02-08
11,"pornm3xmid, izraelmerino, elpajaritodetwt, horchatascdmx, gaypornxxx13",2,2023-02-09
11,"jbmxbzacay, pornm3xmid, izraelmerino, elpajaritodetwt, horchatascdmx",1,2023-02-10
5,"pikes, car, furious, nd, cursed",1,2023-02-11
-1,"orsini, bite, injured, impressive, hahaha",1,2023-02-12
-1,"august, shakira, aged, carton, song",1,2023-02-13
12,"purpurine, fiy, crs, fd, beat",1,2023-02-13
-1,"shakira, blurt, breathes, granulated, kola",2,2023-02-15
-1,"1jimzgt8hw, unprecedented, antis, madrid, turra",1,2023-02-16
-1,"shakira, performance, 53rd, qeytk3taly, singer",2,2023-02-17
-1,"misco, jones, kon, sting, pico",2,2023-02-19
12,"assaulted, immediately, mention, certain, beat",1,2023-02-19
-1,"preservation, culture, plus, cutting, edge",2,2023-02-20
-1,"5c8ln9bcpi, ameiii, taki, rave, funk",2,2023-02-21
-1,"9aedrbxi2a, cordobes, 0or13s1o4t, gh, liga",2,2023-02-22
15,"hbkglafcwa, cereal, session, shakira, spoons",1,2023-02-22
-1,"palmira, pique, nueva, pastries, dulce",1,2023-02-23
-1,"drgrpbts90, shakira, man, full, ass",1,2023-02-24
85,"jaajajajajjajjajja, mie, 5nz5keghpk, piqué, cut",1,2023-02-24
-1,"sjq4bkyunh, reggaeton, hips, rhythm, shakira",1,2023-02-25
-1,"clarachia, shakirabzrpmusicsessionsvol53, tiraera, anuelaa, yailinlamasviral",2,2023-02-26
-1,"shakira, touches, aesthetic, 1yrzwhdxok, lad35bwocy",4,2023-02-27
-1,"jeeta, pedrerol, barsa, darío, et",1,2023-03-02
0,"negreiragate, barcagate, themselves, stoking, obsessive",1,2023-03-02
2,"negreira, month, 000, 20, pudding",1,2023-03-02
6,"hotelier, kangaroo, fetuses, laporta, owed",1,2023-03-05
-1,"elchiringuitodemega, chiringuitobarcelona, culé, christmas, negreira",1,2023-03-07
0,"negreira, odgzhmvm7z, blinds, retires, prosecutor",1,2023-03-08
0,"8l5owe6c8z, rossel, bartomeu, laporte, denounced",1,2023-03-10
6,"ezocl0wxuz, extremist, malicious, nou, camp",1,2023-03-11
-1,"casemiro, negreira, premier, path, kicked",1,2023-03-12
9,"ha, laligasantander, mamés, shivering, negreira",1,2023-03-12
6,"negreira, veña, tricking, sewers, dreaded",2,2023-03-13
9,"txapotista, felon, barsa, communism, survive",1,2023-03-13
6,"negreira, 0kvflxhxgj, dialectics, confidencial, jlwu1jfs9c",2,2023-03-14
6,"fc, headline, barcelona, asaltan, asalta",1,2023-03-15
0,"a12, forecast, negreira, entire, farm",1,2023-03-19
6,"barça, som, rztwhz8uwt, merengue, florentino",1,2023-03-19
-1,"milk, and, https, co, with",1143,2023-04-04
0,"price, of, the, dairy, in",83,2023-04-04
1,"coffee, with, milk, sugar, drink",81,2023-04-04
2,"pudding, rice, mom, make, grandmother",65,2023-04-04
3,"healthy, lifestyle, eating, health, life",43,2023-04-04
4,"bad, what, people, milk, have",34,2023-04-04
5,"hit, car, crashed, had, head",38,2023-04-04
6,"osasuna, mamés, chelsea, soccer, bad",19,2023-04-04
7,"latte, matcha, cold, croissants, fanta",31,2023-04-04
8,"donation, breast, 7yknxxugvy, muihacm99k, hwfxakyneh",5,2023-04-04
9,"asturian, enrollment, launches, languages, asturias",22,2023-04-04
10,"penalty, beaten, cristiano, kick, by",18,2023-04-04
11,"putas, 100, ll, yes, cumtribute",13,2023-04-04
12,"beat, nothing, up, beats, gets",24,2023-04-04
13,"lactose, free, intolerant, light, ordered",24,2023-04-04
14,"chocolate, vanilla, fresh, dark, white",18,2023-04-04
15,"cereal, cereals, first, before, then",18,2023-04-04
16,"almond, milk, assk, 2kx800vnvv, umns8fqkos",21,2023-04-04
17,"cock, dick, hard, my, want",22,2023-04-04
18,"video, videos, rt, pumping, ass",13,2023-04-04
19,"pump, pumping, pcgnt6mgwf, cristianking971, uimjoq9esj",14,2023-04-04
20,"milkshake, egpeibtalk, lnuxyb2its, ivieyubi2e, 1wicn9lkhp",10,2023-04-04
21,"people, bad, are, mi, comments",16,2023-04-04
22,"k4zxlch2se, x0pykp3deb, vlikcy3ko4, jglljs67rg, iozhmayvj8",5,2023-04-04
23,"condensed, strawberries, slushies, seasoning, jurasic",21,2023-04-04
24,"wants, 0yyaeynfdn, cgiroftama, qefoosalk9, 9xwggvh1oh",10,2023-04-04
27,"physical, change, rotation, escamoso, ventino",9,2023-04-04
28,"shake, protein, peanut, workout, muscle",13,2023-04-04
29,"sinleche, veganfta, cow, vaquitas, cows",5,2023-04-04
30,"dulce, de, leche, luases, gondor",12,2023-04-04
31,"painted, as, cow, bad, is",8,2023-04-04
32,"baby, breastfeeding, breast, mom, rulo",12,2023-04-04
33,"mala, leche, o0zhp4hn1s, zs3ghylotp, altieri",9,2023-04-04
34,"ass, 5sfi4gdto6, cxramy9pqg, tayl, bwr1gpywgv",8,2023-04-04
35,"brother, sisters, sister, bezos, bookdepo",6,2023-04-04
36,"leche, xbgek6gnob, tren, akqzgdjy5m, hjkffrdnm9",6,2023-04-04
37,"b64pxwvlnn, spdkibkiue, yxznf2lih7, dawn, wanting",2,2023-04-04
38,"ice, cream, dulce, de, leche",8,2023-04-04
39,"gdhgzvo02s, fua, dulce, de, leche",1,2023-04-04
40,"moisturizing, payroll, hair, chocolate, amazon",9,2023-04-04
41,"physical, change, vl6u6d4hqn, xdlekl8tv3, schnlcorwr",14,2023-04-04
42,"record, tmxmhk9s99, 900m, bmsrbptgnu, fanbase",4,2023-04-04
43,"rich, ass, open, how, yjpunphzzf",9,2023-04-04
44,"cake, cakes, fried, dulce, de",13,2023-04-04
45,"café, con, 1hgapfyi1u, fernandaklle, marianabeli1",4,2023-04-04
46,"face, 7emd5qobg5, q1ddj66pem, g3t4tgva1v, 9dcmkhs3w1",8,2023-04-04
47,"xlah1zitv0, yrlwoxhslm, poot, xwfty3cmvi, fill",3,2023-04-04
48,"powdered, klim, lafauriecabal, hocvzpjxdp, acq8khn7uz",12,2023-04-04
49,"telegram, jxab0ihyhj, privately, group, horny",8,2023-04-04
50,"oatmeal, oat, yum, wrsduvydws, n9tzwbaoff",5,2023-04-04
51,"he, his, smiling, him, returning",7,2023-04-04
52,"00ie8wzkka, x51fnxaxhb, 8h7sdtzjow, vill, ugkommrjhj",12,2023-04-04
53,"mpxyboku12, lxaytadqzj, cv5xkfjeyr, udcsajtjth, 9f2cmkk9qd",5,2023-04-04
54,"hooker, hookers, vyvjfwbame, papuda, hyr2c7o512",8,2023-04-04
55,"tea, 8xznmlkxg1, asqs3iwgwy, lanita, qyl4otkc7h",13,2023-04-04
56,"pancakes, dulce, de, leche, make",16,2023-04-04
57,"paddling, paddle, dulce, lavidasigue, luchaportimismo",4,2023-04-04
58,"kitten, qn6cwzbu6s, nq2vl379pg, fow22cwxd0, cat",4,2023-04-04
59,"tank, tanks, water, teuhqdwnkc, yapatjrhad",6,2023-04-04
62,"birthday, lots, your, lot, on",12,2023-04-04
63,"white, whiter, brown, portal80morbo, oi7lsg3zuo",7,2023-04-04
64,"obfljehdua, nxcroe8jdh, acapulquito, kia2xolzav, morning",3,2023-04-04
65,"teeth, baby, tooth, moves, xrnoh14n3m",9,2023-04-04
66,"tits, nkd4iku07d, mdsk9bvvo8, bijl6x5c1i, y76zw6vaqo",7,2023-04-04
67,"smoothie, z9tdeqquzq, ff3ehahvqe, adversely, apr",4,2023-04-04
68,"strawberry, eegzddvb6y, juice, lulo, aaa",4,2023-04-04
69,"jar, dulce, de, hours, leche",4,2023-04-04
70,"mood, today, bad, in, what",1,2023-04-04
71,"cookies, costco, solve, problems, afternoon",3,2023-04-04
72,"arroz, con, leche, jxpaptve3e, elchecf",7,2023-04-04
73,"rvibbwtka9, nutritional, labeling, labels, label",1,2023-04-04
74,"coconut, coco, rundjb3abz, dxbp0uxkkb, rlbblpeofo",14,2023-04-04
75,"cod, tomato, salad, spinach, cranberry",5,2023-04-04
76,"croissants, coffee, zarhrfwrli, uvicksjped, 850",7,2023-04-04
77,"mu5k, hmgh9qp0pc, migrate, disproportionate, loading",2,2023-04-04
78,"swallow, ttgnnzmrcv, uhvf1eozxw, ceos, messing",3,2023-04-04
79,"daddy, gray, ly4cyjrjfj, choribola, otlm5frue6",7,2023-04-04
80,"bathe, bath, bathed, 7ww9qwnosq, vg4x2u78iz",6,2023-04-04
81,"oreo, oreos, yspfn9aeqj, jo0rycmtux, 6fkritcpep",6,2023-04-04
82,"aaaaaah, clogging, argentinian, dulce, boarding",3,2023-04-04
83,"churros, matesss, dulce, churro, de",5,2023-04-04
84,"8h, ovqghqh60a, 390, quesillo, measured",3,2023-04-04
85,"jsjsjs, jqkdjskska, pmctcaizrr, xglf0edlsl, kjajkjkaja",6,2023-04-04
86,"strawberry, milkshake, 9xlhws4mgw, cherry, giant",3,2023-04-04
87,"breakfast, 8em8vyiktg, zi5gdouwei, twbsmswxn7, qxwy3nf1o5",4,2023-04-04
89,"smell, smells, diaxrje2jm, statues, ono",3,2023-04-04
90,"u4m6m8cd4u, curvy, rt, enduring, radargaymx",1,2023-04-04
91,"sirens, melanie, drink, portals, leche",33,2023-04-04
92,"soy, oriental, overrated, self, control",3,2023-04-04
93,"autent, ruiz, javier, delicious, hblvotpakv",4,2023-04-04
94,"eulcqxsozw, bb, moans, tasty, love",1,2023-04-04
95,"colostrum, cheese, os8vtkvdpy, eddijlhuaq, profuccion",2,2023-04-04
96,"pills, cups, three, warm, night",1,2023-04-04
97,"bread, clycplgjid, fy5andhisf, k7wjvylcqb, mpfv",5,2023-04-04
98,"p9fjy88bck, rubs, asset, inside, bareback",1,2023-04-04
99,"yogurt, greek, og, absurdly, unicorn",2,2023-04-04
100,"butter, bread, dulce, toast, toxic",3,2023-04-04
101,"marcos, romina, julieta, croti, poggi",15,2023-04-04
102,"mccartney, ubbben42gj, cold, abbey, studios",2,2023-04-04
104,"meeeeee, genetics, resist, hp, die",1,2023-04-04
105,"her, stroked, his, he, pironq3rod",6,2023-04-04
106,"spilled, crying, over, cry, sounding",3,2023-04-04
107,"drink, 09ikmxdzy3, lgbngvxxhi, putaaaaa, bocho",3,2023-04-04
108,"eobdjwn1jq, rico, position, blow, ll",1,2023-04-04
110,"bulbs, sneezed, sprinkling, flyer, sardine",3,2023-04-04
111,"licks, lick, iuph0ce85m, cii2twk7jg, clotilde",3,2023-04-04
112,"mixer, ld7o3fm489, fsdm1w7g3s, capuchi, nt8ufitgw2",1,2023-04-04
113,"hot, kbnylhkrzr, hzingxftap, mhrnnjjl39, ylgas7mlgj",7,2023-04-04
114,"dutfs0kw8z, haunting, devoid, disfigured, drew",1,2023-04-04
115,"peanut, butter, mix, delicious, dulce",1,2023-04-04
116,"kxpuzrnhdr, lecche, dame, boot, giblets",1,2023-04-04
117,"10bjvsfubx, expired, realizing, drank, week",1,2023-04-04
118,"tiger, ba0bv5oixj, kircepa9ot, tok, tik",4,2023-04-04
119,"cuckold, wife, 6ibjcmmnvm, vk4gbiifyy, 5571456664",5,2023-04-04
120,"açaí, acarajé, whipped, mill, banana",2,2023-04-04
121,"cappuccino, 0kfoelgmsh, frappetito, mocca, skim",3,2023-04-04
123,"joe, poop, bored, getting, am",1,2023-04-04
124,"banana, 04pmkwnkv1, bananas, shoot, bunch",3,2023-04-04
-1,"milk, and, you, to, the",2236,2023-04-05
0,"in, of, the, production, price",175,2023-04-05
1,"coffee, with, toast, milk, breakfast",177,2023-04-05
2,"rice, pudding, mom, made, grandmother",127,2023-04-05
3,"healthy, lifestyle, diet, eating, health",78,2023-04-05
4,"bad, people, what, milk, have",84,2023-04-05
5,"hit, car, crashed, should, had",72,2023-04-05
6,"barça, madrid, bad, they, boca",77,2023-04-05
7,"latte, thought, hurry, sweetener, was",63,2023-04-05
8,"donation, breast, breastfeeding, babies, donating",19,2023-04-05
9,"asturian, asturiana, asturias, the, lechera",35,2023-04-05
10,"penalty, beaten, flamengo, team, brazil",27,2023-04-05
11,"gay, cum, nsfwtwt, hentai, ass",46,2023-04-05
12,"beat, nothing, beats, up, kkkkkk",45,2023-04-05
13,"lactose, free, intolerant, stomach, intolerance",41,2023-04-05
14,"chocolate, fresh, chokis, milk, vanilla",34,2023-04-05
15,"cereal, cereals, first, then, with",32,2023-04-05
16,"almond, soy, milk, drink, superior",31,2023-04-05
17,"cock, dick, suck, onichan, my",32,2023-04-05
18,"video, videos, pumping, full, rt",20,2023-04-05
19,"pump, pumping, pumped, my, need",30,2023-04-05
20,"milkshake, muzzle, chocolate, cakhpubmon, tdxjayyn2l",20,2023-04-05
21,"people, bad, person, are, be",35,2023-04-05
22,"he, him, his, man, milk",28,2023-04-05
23,"condensed, strawberries, wafers, milk, hqgxijzujn",25,2023-04-05
24,"want, wants, give, e3t0pjaayz, ey9lq1dk9f",22,2023-04-05
25,"cockroach, rule, scientists, joking, science",16,2023-04-05
26,"shaken, getting, think, do, you",1,2023-04-05
27,"physical, change, surprising, lily, herrera",9,2023-04-05
28,"shake, protein, toke, pineapple, posh",16,2023-04-05
29,"cow, yak, incorporating, cows, calcium",9,2023-04-05
30,"dulce, de, leche, loving, thank",26,2023-04-05
31,"painted, as, cow, bad, is",16,2023-04-05
32,"father, baby, mother, children, breast",20,2023-04-05
33,"mala, mythomaniac, leche, que, xglacqfwtp",11,2023-04-05
34,"ass, fill, my, want, butt",20,2023-04-05
35,"brothers, sisters, brother, baby, fe",17,2023-04-05
36,"leche, bonbhfrqap, pronounce, breeding, mid",25,2023-04-05
37,"her, she, flx, hedctfoowx, tochswr9c2",17,2023-04-05
38,"ice, cream, dulce, de, leche",20,2023-04-05
39,"dulce, de, bxpwndjegp, jxmdpvu, n2hcfjzcim",3,2023-04-05
40,"kg, vat, unit, 04, 2023",17,2023-04-05
41,"physical, change, gym, mental, proud",25,2023-04-05
42,"record, broken, broke, records, membership",15,2023-04-05
43,"rich, how, ass, his, kb42yx9oxg",11,2023-04-05
44,"cake, dulce, de, leche, cakes",17,2023-04-05
45,"con, café, cafe, leche, diego",15,2023-04-05
46,"face, mouth, caliclandestina, your, fill",17,2023-04-05
47,"fill, wgv2yzodxp, bs8lgef17s, dmkqljj4d8, 4n6kexhhpe",7,2023-04-05
48,"powdered, sugar, powder, wnhp0iypfz, cfmfcek646",13,2023-04-05
49,"telegram, jxab0ihyhj, channel, privately, write",15,2023-04-05
50,"oat, oatmeal, tt, chileee, auxxiliooo",13,2023-04-05
51,"he, him, milkshake, coffee, cafeteria",17,2023-04-05
52,"recipe, vsx5z7oe8k, vhzzxwxk4b, hrhmguvyeq, 9vxszlmbn8",13,2023-04-05
53,"out, get, p047zvadb8, rhrcrdabuq, surbc2zy1r",7,2023-04-05
54,"hooker, hookers, am, her, omi360pjje",7,2023-04-05
55,"tea, thecloudxbecky, teapot, terrace, tried",23,2023-04-05
56,"pancakes, dulce, de, leche, etrghre4aw",13,2023-04-05
57,"paddling, paddle, dulce, de, leche",8,2023-04-05
58,"kitten, cat, kittens, appeared, cats",10,2023-04-05
59,"tank, tanks, water, hot, ubxpjzs6gc",12,2023-04-05
60,"as, really, say, cow, bad",5,2023-04-05
61,"faceplanting, hanquokka, sabaw, bbokari, skzoo",1,2023-04-05
62,"birthday, lots, your, on, gifts",10,2023-04-05
63,"white, hippopotamus, whiter, ariel, color",11,2023-04-05
64,"morning, wednesday, thursday, holy, good",8,2023-04-05
65,"teeth, baby, tooth, deformity, safvmszn1k",10,2023-04-05
66,"tits, them, those, bmnuhy6t4y, boxrzu9elx",13,2023-04-05
67,"smoothie, fruit, papaya, banana, tayuyos",8,2023-04-05
68,"strawberry, strawberries, fresh, juice, xqq9ynqh96",10,2023-04-05
69,"dulce, de, spoons, leche, jar",8,2023-04-05
70,"mood, bad, qjt4tco2kk, acces, jinwoo",10,2023-04-05
71,"cookies, uptqnqaflj, bzlhagsncf, baacswa9sv, xo9meomcc3",10,2023-04-05
72,"arroz, con, leche, noodles, tfqr987xnj",14,2023-04-05
73,"sugar, dulce, de, leche, has",59,2023-04-05
74,"coconut, jota, lullaby, coco, kkfukkzusl",16,2023-04-05
75,"fish, breakfast, oatmeal, bread, sheep",17,2023-04-05
76,"croissants, coffee, sometimes, 81q0psiyua, dk5es3uiab",7,2023-04-05
77,"tweet, 14emhvcl6r, w9efd8o88a, megalomania, sweatier",4,2023-04-05
78,"swallow, csfmuxjhbf, rffif9nouw, 3cttiekl6g, oyffkcxqyy",5,2023-04-05
79,"daddy, 2xbylptgrx, 77f7khvv4e, quepocamadremex, mexicanolindo3",7,2023-04-05
80,"calentic, dgwk3gp9uv, o3y0lkeanw, gjbarrksf2, bathed",3,2023-04-05
81,"oreos, oreo, foretold, 18sigkmpi1, vcecm80rir",12,2023-04-05
82,"kxomv0l3s3, oanvzz2jg8, jeolf6dltw, sjdjkkkk, argentinian",3,2023-04-05
83,"churros, churro, dulce, de, leche",10,2023-04-05
84,"much, jjemmxftro, wugvjxm9qo, firstdates5a, 10l",8,2023-04-05
85,"jzjdjshjsja, jsjsjjj, guaranga, 9m2izthl8p, hajsnakshahaha",8,2023-04-05
86,"strawberry, milkshake, miiiiiii, t7umfspuhu, yzimcfwqu5",8,2023-04-05
87,"breakfast, p25knxskym, 7pwrddk2cs, wrcrdrva9b, jqmp4sbwug",6,2023-04-05
88,"lpm, bad, aifw5lvejd, bari, what",8,2023-04-05
89,"smell, smells, perfume, lywk9zxmof, clarifying",9,2023-04-05
90,"rt, cztrsbfsap, f5eeabeimo, bv9yt2adj4, rap2ojaimj",6,2023-04-05
91,"sirens, drink, leche, portals, siren",114,2023-04-05
92,"soy, jkfgxuzvuf, lcdjpvwopi, excess, creamier",4,2023-04-05
93,"delicious, fahxvbrauj, 5onakj6ipx, ok_francott, y6csjwdffa",8,2023-04-05
94,"bb, kisses, wherever, mommy, favorite",5,2023-04-05
95,"vamos, cheese, mightymilk, nutrition, hand",15,2023-04-05
96,"sleep, go, catalanes, 6uex6wcunx, glass",8,2023-04-05
97,"bread, breads, eg0h8mj3xq, oihi7omkmn, n253ze5jrr",9,2023-04-05
98,"eggs, egg, loaded, onlyfansbabe, gvvg04v6eo",8,2023-04-05
99,"yogurt, hoyoverse, greek, sachet, buffalo",11,2023-04-05
100,"bread, butter, toast, dulce, de",12,2023-04-05
101,"marcos, romina, bad, yeyo, nacho",13,2023-04-05
102,"cold, glass, unfixed, vtlvvvvv, ayyeeeerr",5,2023-04-05
103,"kill, myself, icy, pudding, bleeding",2,2023-04-05
104,"zhea, handroll, hurt, drink, whole",7,2023-04-05
105,"his, her, he, him, nipples",9,2023-04-05
106,"spilled, cry, over, crying, prevented",6,2023-04-05
107,"qar2ijrteb, ig9pfpt4r7, hypocrisy, drink, toy",3,2023-04-05
108,"rico, ricooooooo, yum, pipipipipipipipi, bqlqigpe9w",8,2023-04-05
109,"mi, te, femboycutie, gemir, hago",2,2023-04-05
110,"laughed, month, gunbound, aqeviykcrb, 6thousand",4,2023-04-05
111,"licking, adwlluq79g, lick, feet, licks",1,2023-04-05
112,"frother, cappuccino, superautomatic, etqnwehr2t, dpluhezmaa",3,2023-04-05
113,"hot, mv5l9nbrct, llqtitpop5, ty5lbbeple, 8zr2dtisbw",4,2023-04-05
114,"opera, soap, uncharismatic, trainspotting, ore8lswhhk",4,2023-04-05
117,"expired, akabo, 2hp88z91nq, cuaaandooo, fl4rvcbgzb",6,2023-04-05
118,"tiger, microfossils, sanadoresyherboristas, 0dwgmwvrcf, yarrow",5,2023-04-05
119,"cuckold, jfzlv5jmfb, 1dcyd7okc0, laid, sees",2,2023-04-05
120,"açaí, whipped, fruit, passion, syd6s7krui",8,2023-04-05
121,"cappuccino, sugar, caramel, lightdeslaxt, sufreeee",6,2023-04-05
122,"shaken, coffee, shake, pulpafit, ramiro",6,2023-04-05
123,"tsxt8gh3fz, shfstbxxuc, poop, shit, hard",2,2023-04-05
124,"banana, g6e8m3vaek, shields, weas, asian",2,2023-04-05
-1,"milk, and, the, https, co",1933,2023-04-06
0,"000, of, the, in, they",156,2023-04-06
1,"coffee, with, milk, drink, and",128,2023-04-06
2,"pudding, rice, made, mom, my",165,2023-04-06
3,"healthy, lifestyle, life, physical, health",78,2023-04-06
4,"bad, what, people, milk, have",66,2023-04-06
5,"hit, head, had, car, was",58,2023-04-06
6,"madrid, bad, barça, the, win",42,2023-04-06
7,"latte, matcha, cold, crescents, iced",45,2023-04-06
8,"breast, breastfeeding, donation, farías, human",12,2023-04-06
9,"asturiana, itzulia2023, asturian, la, santurtzi",54,2023-04-06
10,"penalty, beaten, souza, jael, badly",69,2023-04-06
11,"gay, cum, verga, polla, dick",34,2023-04-06
12,"beat, nothing, up, beats, getting",45,2023-04-06
13,"lactose, free, intolerant, whole, drink",41,2023-04-06
14,"chocolate, fresh, vanilla, milk, dark",28,2023-04-06
15,"cereal, cereals, first, then, before",26,2023-04-06
16,"almond, tastes, milk, bought, rest",27,2023-04-06
17,"dick, cock, suck, my, until",31,2023-04-06
18,"video, videos, ars, photos, onlyfans",26,2023-04-06
19,"pump, pumping, pumped, someone, my",25,2023-04-06
20,"milkshake, bury, solve, fqs2ax65t1, y5ll1uw03u",13,2023-04-06
21,"people, bad, envious, how, be",23,2023-04-06
22,"he, him, his, rufus, televisa",18,2023-04-06
23,"condensed, strawberries, foam, asraf, octagons",26,2023-04-06
24,"wants, want, give, who, https",24,2023-04-06
25,"cockroach, rule, scientists, joking, feed",45,2023-04-06
26,"shaken, shake, qorc12bk7d, zolp, v258i10wri",10,2023-04-06
27,"physical, change, yahir, mena, shocking",13,2023-04-06
28,"shake, protein, weight, figurmed, metabolaid",13,2023-04-06
29,"cow, livestock, cows, udder, sos",14,2023-04-06
30,"dulce, de, leche, invention, yo",23,2023-04-06
31,"painted, as, cow, bad, is",25,2023-04-06
32,"baby, son, mother, father, dad",21,2023-04-06
33,"mala, leche, reformas, andreavillag0me, 4r56y13bck",12,2023-04-06
34,"ass, dripping, my, butt, fill",19,2023-04-06
35,"brothers, sisters, brother, sister, fffqgnsihh",16,2023-04-06
36,"leche, orca, driiiink, arequipe, la",18,2023-04-06
37,"her, she, lana, herself, p3nvsnbj1f",15,2023-04-06
38,"ice, cream, dulce, de, leche",19,2023-04-06
39,"dulce, souffle, atvbzzpimq, rkzhgmohrm, qpgz3gcnch",4,2023-04-06
40,"gusto, dolce, lindor, price, lindt",13,2023-04-06
41,"physical, change, gym, retrained, rvmaby0gc8",10,2023-04-06
42,"record, broken, broke, batanetes, records",11,2023-04-06
43,"rich, how, ass, af52cao2og, uygsu8bizx",20,2023-04-06
44,"cake, llrfafhjl6, yess, corina, cuatro",3,2023-04-06
45,"café, con, leche, cafe, relaxing",12,2023-04-06
46,"face, fill, mouth, 6tbmdesla2, cfykkyzmzn",12,2023-04-06
47,"fill, calzón, jkt0n4hf3a, hdsppbpm, umzkex3gor",11,2023-04-06
48,"powdered, secretly, klim, dawn, wew0brslhp",15,2023-04-06
49,"telegram, channel, privately, video, content",14,2023-04-06
50,"oat, oats, oatmeal, 1q0umhgbcn, cinnamon",9,2023-04-06
51,"he, him, shyness, coffee, his",14,2023-04-06
52,"google, kqjvt2mlpf, 2fsexdxspl, mcen3wk2tv, zjt4tsxlyv",12,2023-04-06
53,"wtn2zxbscz, azn6zp5wep, lzjwzjmihr, bt2jildpch, bplzmikmrn",6,2023-04-06
54,"hooker, hookers, little, big, ass",15,2023-04-06
55,"tea, tapioca, onigiri, hojicha, bubble",11,2023-04-06
56,"pancakes, dulce, de, leche, syswulctjf",9,2023-04-06
57,"paddling, dulce, de, leche, rowing",12,2023-04-06
58,"cat, cats, kitten, tfqdrm2pde, bj4ljkds3p",9,2023-04-06
59,"tank, tanks, water, ddb11f9yee, afplaekh2i",7,2023-04-06
60,"as, really, say, cow, bad",18,2023-04-06
61,"pasteurized, 59guynugfi, skimmed, values, calories",1,2023-04-06
62,"birthday, lots, on, lot, tokischa",14,2023-04-06
63,"white, whiter, than, color, gatitosricoxxx",10,2023-04-06
64,"maundy, morning, thursday, good, sunday",13,2023-04-06
65,"teeth, baby, butterflies, feel, pjradd9psx",6,2023-04-06
66,"tits, xsdjcilvt2, 9mous72jrz, llobe9lkno, nf4pksdzok",7,2023-04-06
67,"smoothie, green, fruit, 3rj1qrv3m1, a2xgflrpfw",6,2023-04-06
68,"strawberry, juice, strawberries, cbbfe5p4gj, lechoza",9,2023-04-06
69,"dulce, de, leche, eating, bottle",10,2023-04-06
70,"mood, bad, 2cmpvgbyka, smut, f5",6,2023-04-06
71,"cookies, cookie, igfnuva9b5, hjh7einc97, marias",7,2023-04-06
72,"arroz, con, leche, amp, 3sfudvy3qa",10,2023-04-06
73,"sugar, dulce, de, leche, has",138,2023-04-06
74,"coconut, kakela, preserves, never, ironic",9,2023-04-06
75,"unit, chives, lunch, flakes, spoons",6,2023-04-06
76,"croissants, coffee, mm9hl18w7n, b26jzwmuso, pffffff",8,2023-04-06
77,"tweet, twitter, wbycz0cvjd, htww8swgz5, cancheritos",5,2023-04-06
78,"swallow, swallowing, 0xq4utq7w1, t1owyv0hbz, gsk9pxshq2",7,2023-04-06
79,"daddy, mistercopafeel, ge, feat, conanobrien",8,2023-04-06
80,"bathe, bathed, bath, qs2uygttwd, dv7cajfpay",5,2023-04-06
81,"oreo, oreos, bfhtuxuxkt, himoxz0fxj, farmatodo",7,2023-04-06
82,"argentinian, argentina, dulce, de, leche",13,2023-04-06
83,"churros, churro, dulce, de, leche",10,2023-04-06
84,"14x21, cggxnawb07, zupchndjyt, g2xv2rilip, 100x70",5,2023-04-06
85,"nghwtch, cbz0wmyipf, refrigerating, jajsjajsjsjaj, hahahajakajakaja",10,2023-04-06
86,"strawberry, milkshake, wxc2hlkpmh, hymahlfc1g, mmm",9,2023-04-06
87,"breakfast, krm4g0rxiv, chavitocogelon, pwh67ntqi4, 7ki4wj5uoc",8,2023-04-06
88,"lpm, kag2hxzdrr, jajbaaj, p7huvjmsmn, erased",5,2023-04-06
89,"smell, belched, joaquim, smells, blondes",4,2023-04-06
90,"rt, awbjleqyen, vqn7z7obgy, i9wgvp5jea, 1zvuxd4lpa",4,2023-04-06
