Topic,Words,Frequency,Timestamp
20,"milkshake, faltering, of8is9y8u0, braaaah, rjgwfz2bzf",24,2023-04-17
21,"people, bad, understand, how, liverrr",54,2023-04-17
22,"pond, he, him, his, uzla8kd0qc",35,2023-04-17
23,"condensed, isowvoaqhs, malted, weekends, careful",32,2023-04-17
24,"hcm2ly33cs, exkrtcqpvr, wants, vdwt3rjpbh, nr6mwdryim",13,2023-04-17
25,"cockroach, rule, scientists, joking, feed",56,2023-04-17
26,"shaken, shake, voice, unnoticed, pq6x2ffq1v",40,2023-04-17
27,"physical, change, iván, morales, guru",25,2023-04-17
28,"shake, protein, superhuman, slowly, becoming",24,2023-04-17
29,"cow, cows, calcium, ions, ve4jv4eei9",34,2023-04-17
30,"dulce, de, leche, ehhh, 7tgc5chfa1",22,2023-04-17
31,"painted, as, cow, j06labglwm, bad",26,2023-04-17
32,"baby, mom, mother, fqhasyjcs4, npyblncgbw",34,2023-04-17
33,"mala, leche, qybd3swioz, sonichu, gf0nu1ddle",24,2023-04-17
34,"ass, hwlgnptteh, w77d0iknc1, fill, break",24,2023-04-17
35,"brothers, sisters, explode, 2zw88lidgz, brother",22,2023-04-17
36,"leche, cfoonxamb4, or6ifxcs0f, jew, la",18,2023-04-17
37,"her, she, 1oyhihpaub, zfuqal1rfu, satisfy",18,2023-04-17
38,"ice, cream, dulce, de, leche",24,2023-04-17
40,"sensitive, sun, skin, ip50, delial",31,2023-04-17
41,"physical, change, 1q68czgrws, age, extreme",19,2023-04-17
42,"record, broken, euphoria, nap, xexjonvwjp",24,2023-04-17
43,"rich, 8afybfgh9e, rhaceuwzvk, 6wveojpkjz, mema",21,2023-04-17
44,"cake, fried, dulce, de, leche",25,2023-04-17
45,"con, café, leche, 8bvc7cn6qq, f5gdscd7co",28,2023-04-17
46,"face, uhazvlxb5h, cw61ainhy4, qpt3z6agzk, your",29,2023-04-17
47,"fill, p7gegjifwq, jgoxzteqhm, komi, updnhe7dlk",19,2023-04-17
48,"powdered, humble, world, sugar, keeps",52,2023-04-17
49,"telegram, nljjgzmd6c, gc4z3vohz4, channel, qgp6mir6jk",12,2023-04-17
50,"oat, oatmeal, qksem4vdg7, ojo, kinda",21,2023-04-17
51,"he, girlorbxy, sleep, warm, him",21,2023-04-17
52,"yau6wmtfmc, xurrasco, to3ti9atzf, qoulvax6kh, cgzk0ottyc",6,2023-04-17
53,"et9unma2jd, 79xbb5nzkq, out, get, hvdqq2ks2i",13,2023-04-17
54,"hooker, in97fqcstm, camelto, un3web2zol, swallows",23,2023-04-17
55,"tea, jvy0kdeoqn, flashback, ratatouille, bubble",29,2023-04-17
56,"pancakes, dulce, de, leche, escobarr",18,2023-04-17
57,"paddling, maalll, raises, dulce, doubts",11,2023-04-17
58,"cat, kitten, cats, b8t8yn76hq, grimmi",23,2023-04-17
59,"tank, tanks, water, iisgzwnrsd, yvfsq7kynw",20,2023-04-17
60,"as, really, say, cow, 8955uwjbgt",12,2023-04-17
61,"semi, cfp6fuznr1, skimmed, values, calories",1,2023-04-17
62,"birthday, sing, lots, lot, your",19,2023-04-17
63,"white, bottled, 8ofdzmynhq, ueuchuxvzz, mf4g68pet0",9,2023-04-17
64,"deseos69vhsa, hci58hm9dk, 1yvoromeqw, machín, pas",15,2023-04-17
65,"teeth, baby, tooth, speechles, upp7iaelzz",23,2023-04-17
66,"tits, hiuzxfbkoz, pqoqvcctxx, okszi2lvcu, 6rzq2mas6e",16,2023-04-17
67,"smoothie, blackberry, strawberry, mowcfuliwk, pha9dlhrsr",7,2023-04-17
68,"strawberry, juices, yia, wqcyhbeyyd, juice",10,2023-04-17
69,"jar, dulce, de, spoonful, leche",19,2023-04-17
70,"mood, bad, ljt077plbf, cocolandia, tx",26,2023-04-17
71,"cookies, stuck, swear, chips, onesimum",8,2023-04-17
72,"arroz, con, leche, rn, gonna",14,2023-04-17
73,"hexagons, schizophrenics, light, diabetics, sugar",8,2023-04-17
74,"coconut, articulate, bacardi, reminder, occurred",16,2023-04-17
75,"grilled, chick, breakfast, egg, dinner",23,2023-04-17
76,"croissants, croissant, coffee, zskdfizbgu, unisex",6,2023-04-17
77,"1fmxtchkox, tweets, aged, twitter, suekx8pp6a",10,2023-04-17
78,"swallow, zbxof1hocw, setb5xzdci, 7os9zj9ugu, c2ibsesqos",11,2023-04-17
80,"bath, bathe, onozm9ilit, xtuvceb6u8, 1pp6d3q1rf",25,2023-04-17
81,"oreo, oreos, 89pnsh8dhi, inc1yuciko, worries",21,2023-04-17
82,"stereotypes, argentines, oetjlun48x, erroneous, limbs",3,2023-04-17
83,"churros, diosss, warm, dulce, de",6,2023-04-17
84,"otherwise, mentalist, capis, wmrgnjbblp, pa1gyoidv7",11,2023-04-17
85,"tylwervssu, jajsjajsjs, 4pxfegxadp, qjajajajajaajqjajajajajajajajajajajajajajajajajajajajajajajajajajajajajajajajajajajajajajaj, guginyq3nw",18,2023-04-17
86,"strawberry, milkshake, made, 0geen8rbgg, hk2ltjowac",9,2023-04-17
87,"breakfast, lend, toy, judit, qrogay",9,2023-04-17
88,"lpm, jalil, bad, what, tremendous",17,2023-04-17
89,"smell, matheo, camita, smelling, smells",7,2023-04-17
90,"rt, 7pim8nlipu, chubby, takes, give",9,2023-04-17
91,"sirens, drink, from, leche, z0lxbqemz0",6,2023-04-17
92,"soy, gud, bastardly, charcoal, process",17,2023-04-17
93,"j1flznmuwr, delicious, vaz4tf7kym, mhu3ztob1t, by0feplwgj",10,2023-04-17
94,"bb, kisses, ksfb0uk63u, mmm, mommy",8,2023-04-17
95,"cheese, category, castelmagno, cheeses, hidalgo",6,2023-04-17
97,"bread, gpmyjcmcl3, mzduj9oost, p0lyaplxja, irrelevant",5,2023-04-17
98,"eggs, wic, mana, learns, egg",11,2023-04-17
99,"yogurt, seriously, isn, grupo, upset",6,2023-04-17
100,"bread, ezfwifsaet, nz3f6rvthv, jaksjs, toast",15,2023-04-17
101,"vvtenshlge, marcos, attention, knhf2jbu9x, tank",8,2023-04-17
102,"tbxiqnpjzs, glass, cold, ijvymgn3ga, gkdejgtvff",7,2023-04-17
103,"kill, myself, pudding, rice, want",15,2023-04-17
104,"ayyyeee, chaca, whole, puke, drink",5,2023-04-17
105,"his, threads, her, nnumyiwprt, grabbed",9,2023-04-17
106,"spilled, cry, over, k6uxdkmts0, crying",10,2023-04-17
107,"lk1trxx4fd, drink, hole, drinking, every",9,2023-04-17
108,"rico, bb, 1wkkppuyaw, 9bj93ohqof, dgmgplqvg3",8,2023-04-17
109,"cremi, marravirroso, dulcesito, xocolá, shou",9,2023-04-17
110,"told, lay, stranger, conversation, he",2,2023-04-17
111,"ahcashfxen, pancarteroooooos, a36jjhg4bk, lick, licks",2,2023-04-17
112,"frother, automatic, machine, breville, amazon",8,2023-04-17
113,"hot, mermevnjpb, 8i84pjwa1g, gatubela, c83ypchdlk",4,2023-04-17
114,"ys3ssfbwbb, aladdin, mts, tarzan, iggy",2,2023-04-17
115,"lrq9x1r, a9nzqsyzi7, butter, fats, palm",1,2023-04-17
117,"expired, pyrobos, francamente, 4th, refrigerator",15,2023-04-17
118,"tiger, o4ym1ajf6j, 20pts, chifles, piura",2,2023-04-17
119,"cuckold, cuckold_husband, 32l31jg6qu, cuckoldqueen, cuckoldperu",8,2023-04-17
120,"açaí, colossal, açai, fruity, equal",3,2023-04-17
121,"cappuccino, ex9iuqg5zq, frappuccinos, 10, iced",11,2023-04-17
122,"shaken, shake, coffee, kat, kit",19,2023-04-17
123,"poop, 0dyzbebwaq, alarm, jam, pancakes",11,2023-04-17
124,"wise, banana, frutitaaaaas, fruits, make",5,2023-04-17
-1,"milk, and, co, https, to",2033,2023-04-18
0,"production, conaprole, the, in, of",243,2023-04-18
1,"coffee, with, milk, and, cold",165,2023-04-18
2,"pudding, rice, made, making, mom",109,2023-04-18
3,"healthy, eating, diet, lifestyle, living",104,2023-04-18
4,"bad, what, milk, are, have",77,2023-04-18
5,"hit, crashed, car, had, have",57,2023-04-18
6,"bad, napoli, boca, players, team",76,2023-04-18
7,"latte, cold, croissants, bed, warm",62,2023-04-18
8,"breast, bank, mancha, breastfeeding, toledo",35,2023-04-18
9,"asturian, asturias, asturiana, the, investment",38,2023-04-18
10,"penalty, beaten, giroud, kvara, supposed",56,2023-04-18
11,"gay, cum, femboy, rt, cumtribute",44,2023-04-18
12,"beat, beats, nothing, beaten, up",37,2023-04-18
13,"lactose, free, intolerant, stomach, whole",40,2023-04-18
14,"chocolate, fresh, vanilla, choco, krispis",34,2023-04-18
15,"cereal, first, cereals, then, before",27,2023-04-18
16,"almond, milk, flavor, taste, coffee",35,2023-04-18
17,"cock, dick, suck, my, penis",31,2023-04-18
18,"video, videos, rt, dm, upload",27,2023-04-18
19,"pump, pumping, pumped, vnwsh8mbyi, my",30,2023-04-18
20,"milkshake, pros, milkshakes, edgi0kjhau, darxssr00b",21,2023-04-18
21,"people, bad, person, envious, are",31,2023-04-18
22,"he, him, his, gets, criminal",24,2023-04-18
23,"condensed, strawberries, add, icosajmeyg, sv3pszxxza",21,2023-04-18
24,"want, wants, kt5pesdcjf, 725jmdv7zu, p1ez0fza4k",14,2023-04-18
25,"cockroach, rule, science, option, drinking",29,2023-04-18
26,"shaken, shake, step, shaking, up",13,2023-04-18
27,"physical, change, revolutionized, sudden, miguel",48,2023-04-18
28,"shake, protein, shaker, shakes, weight",21,2023-04-18
29,"cow, cows, proteins, dairy, provides",25,2023-04-18
30,"dulce, de, leche, lift, nugiojxfgv",17,2023-04-18
31,"painted, as, cow, bad, is",10,2023-04-18
32,"baby, mother, breast, father, given",18,2023-04-18
33,"mala, leche, mina, que, fjonezzyzt",12,2023-04-18
34,"ass, fill, want, dump, full",17,2023-04-18
35,"brothers, sisters, brother, jeni, sister",22,2023-04-18
36,"leche, traga, la, e6yyypdyfh, agenttrailer",15,2023-04-18
37,"her, she, csre69a8oy, liidgvzjkd, ajnkqp1mxi",14,2023-04-18
38,"ice, cream, dulce, de, leche",12,2023-04-18
39,"dulce, de, leche, forever, obvious",22,2023-04-18
40,"sensitive, amazon, sun, offer, delial",33,2023-04-18
41,"physical, change, mental, gym, months",17,2023-04-18
42,"record, broken, broke, mszgnhwchd, records",12,2023-04-18
43,"rich, kxcdptkdw9, 4vdo8mxrvz, trujillogay, sledgehammers",11,2023-04-18
44,"cake, gt, dulce, de, leche",10,2023-04-18
45,"con, café, cafe, leche, leite",23,2023-04-18
46,"face, mouth, fill, sobaos, my",18,2023-04-18
47,"fill, filled, rhm8ep8tyd, gdxynybmmp, skndky0nc7",12,2023-04-18
48,"powdered, klim, sugar, fg5t6nliu1, yro5pjfkh3",15,2023-04-18
49,"telegram, channel, group, subscribe, full",8,2023-04-18
50,"oat, oatmeal, oats, overnight, toni",17,2023-04-18
51,"he, him, coffee, leaves, she",11,2023-04-18
52,"pv66pvesyv, 0mbf3b3xyo, nlgosgmvkz, rzl4wab7wt, ry5h9brtoq",14,2023-04-18
53,"get, out, 9qt6n3spxy, 4v8l88ajpu, wi8tbboeyl",12,2023-04-18
54,"hooker, hookers, little, uadzbyozfv, 83v6dpurxa",12,2023-04-18
55,"tea, pearls, teapots, grapefruit, aloe",21,2023-04-18
56,"pancakes, dulce, de, leche, some",16,2023-04-18
57,"paddling, dulce, de, leche, dejà",9,2023-04-18
58,"kitten, cat, kittens, cats, her",15,2023-04-18
59,"tank, water, heater, hot, troll",16,2023-04-18
60,"as, really, say, cow, bad",14,2023-04-18
62,"birthday, lots, la_kimka, on, your",8,2023-04-18
63,"whiter, white, grass, than, hahahahahahahahahahahahahahahahahahahahahahahahah",7,2023-04-18
64,"morning, wake, good, up, tuesday",16,2023-04-18
65,"teeth, baby, tooth, mouse, perez",10,2023-04-18
66,"tits, n0visqjcck, tittytuesday, uajajsjsjsjaj, hqoulc01xh",6,2023-04-18
67,"smoothie, fruit, green, banana, liquefied",14,2023-04-18
68,"strawberry, juice, vm3ehtbril, karajo, q2iyyvctcx",7,2023-04-18
69,"dulce, de, leche, jar, pot",11,2023-04-18
70,"mood, bad, tooommmmbaaaa, jshdjshd, mwoiv5ah1w",7,2023-04-18
71,"cookies, cookie, m0vvbw6axu, dh4wwelmpu, nsz9iw7gkr",9,2023-04-18
72,"arroz, con, leche, hint, 5jqowshfyy",9,2023-04-18
73,"sugar, excess, dulce, alfajor, de",12,2023-04-18
74,"coconut, osa6ouxcrk, i5wkhqyhpe, goncha, ironies",7,2023-04-18
75,"breakfast, dinner, cheese, potato, egg",15,2023-04-18
76,"croissants, coffee, with, patients, isakk",19,2023-04-18
77,"twitter, tweet, caraeguebo, b17hr75rgf, airenj2nuk",5,2023-04-18
78,"swallow, wothqagrnh, fcj2c5qkdr, wqlldusqdn, 91mqklbmdy",4,2023-04-18
79,"daddy, gjzw7qqwxm, ljdxg2gf4u, milk譲, pfcsl9vrec",2,2023-04-18
80,"bath, bathe, shower, bathed, j3jn3716z3",16,2023-04-18
81,"oreo, ordfngwrzi, cloying, sweet, triple",2,2023-04-18
82,"argentinian, balance, vvr8eectap, 18usd, dulce",4,2023-04-18
83,"churros, churro, dulce, de, leche",7,2023-04-18
84,"much, how, nrbq1lwk2k, ybky5q4l5w, cuanta",9,2023-04-18
85,"ksjsjdj, lweeui0qgc, kgz1viaz5r, duvan, jajkajajaj",5,2023-04-18
86,"strawberry, milkshake, o6pxgwgpgz, 59cylljoiy, u3z5uy8t2j",5,2023-04-18
87,"breakfast, ggjkcgccjl, khk1amu89x, jiwoongbxg, 4wsovponkv",8,2023-04-18
88,"lpm, crave, mates, bad, what",3,2023-04-18
89,"smell, smells, venomous, vpy2my8enn, winstead",5,2023-04-18
90,"rt, if, give, rjxirzc8g2, p3bjuqddv7",10,2023-04-18
91,"siren, drink, from, leche, sirens",1,2023-04-18
92,"soy, fw7ac9ek8l, plgapxpgdq, dobwzxvudt, xia",13,2023-04-18
93,"delicious, ivm3px0vyg, x5bismecue, hahahahahahahajsjsbsbsbshsbshs, u9ockapodu",5,2023-04-18
94,"bb, w5phq2chx6, h93kjfh5ck, wherever, kisses",2,2023-04-18
95,"cheese, goat, cheeses, perales, raw",6,2023-04-18
96,"sleep, glass, bed, 0utygstcmp, fuj0vo1w56",7,2023-04-18
97,"bread, ls6cbkfo63, rzyltvnf83, mavericks, equide",8,2023-04-18
98,"eggs, egg, hit, eat, bbncmxqnzp",4,2023-04-18
99,"yogurt, tablespoon, byni3ek5xv, 92hmakxlyc, zggj7ofjcv",7,2023-04-18
100,"butter, bread, toast, dulce, de",11,2023-04-18
101,"marcos, about, thiago, julieta, qeyivsqegw",9,2023-04-18
102,"cold, l0a7qzzx2w, qpx0l9e0ov, creepy, glass",5,2023-04-18
103,"kill, myself, pudding, rice, want",3,2023-04-18
104,"again, 76lmdm0a11, weyyy, drink, anemia",4,2023-04-18
105,"lightly, his, felt, lips, her",4,2023-04-18
106,"spilled, cry, over, crying, 9yblnjzrhe",7,2023-04-18
107,"drink, 4aall3wgbz, kongpob, n3zofybzd2, ftunx641mc",5,2023-04-18
108,"sacadita, itjadbnfh5, rico, services, oral",1,2023-04-18
109,"darías, la, uoudt2xysy, ix7vb1eruo, mi",7,2023-04-18
110,"ch0rr0s, me, mom, saciand0, desfl0rand0",6,2023-04-18
111,"lick, licking, insoles, transform, feet",7,2023-04-18
112,"frother, robotics, kawasaki, machine, duaro",3,2023-04-18
113,"hot, jef1axtfer, b9wsqmwp4f, 1f4dj2pqfn, j0pid4c24f",6,2023-04-18
114,"soap, ut9fj3lvwi, moffat, rwudft0pxz, dracula",4,2023-04-18
116,"lecche, dame, mdjtb2n9oi, afdgpgsfdu, boot",2,2023-04-18
117,"expired, tests, qhd, l9cruyehx6, viscochuelo",5,2023-04-18
118,"tiger, h1hhgxjbg7, incakola, lucianazurita_, bromelain",8,2023-04-18
119,"cuckold, wife, lfn1v2rgbt, zpwgqpmqrj, elperver26",6,2023-04-18
120,"açaí, xftcc8cykr, udcsimqhvj, 700ml, sensational",2,2023-04-18
121,"reinventing, frapuccino, soy, wouldn, mocha",2,2023-04-18
122,"shake, shaken, coffee, 51degccl6i, qblcflry2k",8,2023-04-18
123,"poop, utpm7ah93a, xn1tfvf2c3, jeon, pooping",4,2023-04-18
124,"banana, liquefied, bananas, submarine, liqueur",4,2023-04-18
-1,"milk, and, the, of, that",2002,2023-04-19
0,"production, of, the, in, meat",293,2023-04-19
1,"coffee, with, milk, drink, myself",140,2023-04-19
2,"pudding, rice, made, dessert, mom",111,2023-04-19
3,"healthy, lifestyle, diet, life, living",98,2023-04-19
4,"bad, what, people, milk, god",65,2023-04-19
5,"hit, car, crashed, head, had",72,2023-04-19
6,"boca, bad, club, they, barco",81,2023-04-19
7,"latte, matcha, croissants, myself, at",76,2023-04-19
8,"breast, breastfeeding, bank, donation, human",37,2023-04-19
9,"asturian, asturias, asturiana, fabada, the",37,2023-04-19
10,"penalty, beaten, hit, scored, well",39,2023-04-19
11,"cum, gay, cumtribute, hentai, cumshot",38,2023-04-19
12,"beat, nothing, beats, beaten, kkkk",28,2023-04-19
13,"lactose, free, intolerant, drink, stomach",28,2023-04-19
14,"chocolate, fresh, krispis, bar, choco",36,2023-04-19
15,"cereal, cereals, first, before, eat",20,2023-04-19
16,"almond, bought, coffee, milk, almendra",36,2023-04-19
17,"cock, dick, suck, cocks, my",33,2023-04-19
18,"video, 7pjhyk8vzc, videos, rt, eiw4yc88sf",26,2023-04-19
19,"pump, pumping, who, pumped, someone",25,2023-04-19
20,"milkshake, peaches, having, meatball, chocolate",34,2023-04-19
21,"people, bad, envious, comments, are",24,2023-04-19
22,"he, him, his, man, they",23,2023-04-19
23,"condensed, blah, i9o8fopgc4, zic6vitjeh, glzstwwdze",18,2023-04-19
24,"wants, want, give, who, https",22,2023-04-19
25,"cockroach, rule, scientists, joking, feed",37,2023-04-19
26,"shaken, shake, shaking, up, nn",22,2023-04-19
27,"physical, change, survivors, his, shocking",38,2023-04-19
28,"shake, protein, muscle, weight, mass",23,2023-04-19
29,"cows, cow, calcium, calves, raw",21,2023-04-19
30,"dulce, de, leche, anita, colet",19,2023-04-19
31,"painted, as, cow, bad, is",22,2023-04-19
32,"baby, breast, birth, mom, born",19,2023-04-19
33,"mala, leche, la, unga, headline",17,2023-04-19
34,"ass, little, yum, fill, dripping",14,2023-04-19
35,"brother, brothers, sisters, sister, chijgnukia",14,2023-04-19
36,"leche, la, b4cyiza7kj, dma, rkegero9aa",14,2023-04-19
37,"her, she, 76qdzj9fde, ujnlpqgghx, fy0okn29oh",11,2023-04-19
38,"ice, cream, dulce, de, leche",11,2023-04-19
39,"dulce, de, leche, obvious, wz8fyol5tz",16,2023-04-19
40,"fuerteventura, amazon, skin, sensitive, tablet",15,2023-04-19
41,"change, physical, training, weight, months",12,2023-04-19
42,"record, broken, bts, broke, fandom",10,2023-04-19
43,"rich, utjllsklgx, fgwrzofe2x, bfyxsr8fmp, richaaaaaaaaaaaa",6,2023-04-19
44,"cake, dulce, fried, de, cakes",13,2023-04-19
45,"con, café, cafe, leche, tampa",14,2023-04-19
46,"face, mouth, fill, your, would",19,2023-04-19
47,"fill, with, filled, up, jujgfewc0v",19,2023-04-19
48,"powdered, klim, dungeon, sugar, powder",13,2023-04-19
49,"telegram, channel, info, subscribe, rt",12,2023-04-19
50,"oatmeal, oat, oats, overnight, pot",14,2023-04-19
51,"he, him, coffee, his, didn",16,2023-04-19
52,"6ucvrvt1wf, 7ip36rhjfl, tilaw8tlwb, 1ef8jtuj5d, duwbup4obf",11,2023-04-19
53,"out, get, lvlzqkgyon, s6s5vswgrl, aiebkpde5r",10,2023-04-19
54,"hooker, hookers, little, dominacion, roleplay18",8,2023-04-19
55,"tea, teapot, honey, dbz, tsjgf2xgx0",20,2023-04-19
56,"pancakes, dulce, de, leche, marginalist",13,2023-04-19
57,"paddling, dulce, paddle, de, llao",7,2023-04-19
58,"cat, kitten, cats, wants, kittens",11,2023-04-19
59,"tank, tanks, water, hot, heater",15,2023-04-19
60,"as, really, say, cow, bad",10,2023-04-19
62,"birthday, bayq3qidvf, mlbd7kvved, tokischa, lots",5,2023-04-19
63,"white, 1vuxqdvufn, 6fqxgmq5p6, 6yuhrktmm7, i5bcj5nahj",7,2023-04-19
64,"morning, wake, 5j6tvda39t, siuuuuu, dtzhgplr4e",6,2023-04-19
65,"teeth, tooth, baby, shwnhlcnzu, hahahaaka",6,2023-04-19
66,"tits, wet, nipples, gfec9ct9oz, n6fo8lezb2",11,2023-04-19
67,"smoothie, smoothies, hive, banana, hytoshy",11,2023-04-19
68,"strawberry, juices, nvme7sikos, vb5zqpevbe, juice",8,2023-04-19
69,"jar, dulce, de, leche, spoonfuls",10,2023-04-19
70,"mood, betray, bad, theon, sjsdkk",6,2023-04-19
71,"cookies, cookie, rr7hgzuzt9, rueywuqxvu, yvxi2d5rg9",14,2023-04-19
72,"arroz, con, leche, wierd, slthqkhx8t",8,2023-04-19
73,"sugar, excess, dulce, de, leche",14,2023-04-19
74,"coconut, ik6bnlwssb, chachi, underrated, lucas",8,2023-04-19
75,"lentils, breakfast, colo, banana, potato",11,2023-04-19
76,"croissants, coffee, dasq9v5wxr, zgrqpec7mt, sarsfield",7,2023-04-19
77,"twitter, tweet, eboi9qbvbr, rpbhenfzca, ieyeysgypp",9,2023-04-19
78,"swallow, swallowing, qzqfmvwn3d, fa8dqn98t4, 9tx75iwieb",8,2023-04-19
79,"daddy, fln58mcnjw, tejfumbb6u, vnffgurtpq, ji7oipealc",8,2023-04-19
80,"bathed, pewu24mqor, 9lhyxz9vjr, fmwp4pguue, nipsnkrmow",4,2023-04-19
81,"oreo, oygqy7zc0b, oreos, photosynthesis, cocaine",4,2023-04-19
82,"argentina, argentinian, dulce, argentines, de",10,2023-04-19
83,"churros, mk3iecrtpe, churro, physically, dulce",3,2023-04-19
84,"much, plush, how, 350p, ffyb8b3z62",10,2023-04-19
85,"daledale, jjm5gsglss, kahajahajsjajs, jaksjj, jjfz0vcnhw",5,2023-04-19
86,"strawberry, milkshake, qi0qr3jj9c, lmsafqnwm2, puc",8,2023-04-19
87,"breakfast, disasterchefs2, bl3lusfgkn, honeybags, 7m2sbmxiob",5,2023-04-19
88,"lpm, bad, borges, casino, ahh",7,2023-04-19
89,"smell, smells, tragametierra, douodcifxh, ef2kahmq08",8,2023-04-19
90,"rt, if, give, you, radargaymx",14,2023-04-19
91,"sirens, 5g7u3l6d9p, drink, omfg, yall",4,2023-04-19
92,"soy, aq09lockh5, s5v6rrsjh6, gadis, chopped",4,2023-04-19
93,"delicious, lgot6fwb0h, nh2nvznunk, lm9s03nrao, sjynhogsma",7,2023-04-19
94,"bb, kisses, mommy, favorite, wherever",12,2023-04-19
95,"8vrfults1a, paprika, categories, stood, reserve",1,2023-04-19
96,"v7cmbnhxvc, fuckgirl, sleep, glass, go",3,2023-04-19
97,"bread, tss, jlvjafovnb, ukbbvl60di, jmfzjmkbgd",4,2023-04-19
98,"eggs, aro, egg, loaded, 6r9pzvgwih",7,2023-04-19
99,"yogurt, sachet, 77shuqnhi9, vovmprfda6, uk5qdpkpcj",6,2023-04-19
100,"bread, butter, dulce, de, toast",6,2023-04-19
101,"marcos, sol, ssbahcgwwd, feigns, s1m1os",5,2023-04-19
102,"cold, glass, v0yzhqkl7m, 9hwcp412x5, 5l5unslyds",8,2023-04-19
103,"kill, myself, pudding, rice, want",1,2023-04-19
104,"drink, whole, poppies, anecdote, again",6,2023-04-19
105,"hypnotic, yo, xyjhp44q6g, nibbling, zl8aomnjnc",3,2023-04-19
106,"spilled, cry, over, vlx61it4pa, ghrtgnod2v",7,2023-04-19
107,"drink, ryeowrvymd, 8r10n3fcax, b2v5v0btqu, _no",6,2023-04-19
108,"rico, i3r6ygju64, fmexjm8onm, condon, comas",3,2023-04-19
109,"vkhsrhwhbl, en, un, la, ufby8hxmzs",4,2023-04-19
110,"parents, restful, relieving, door, went",5,2023-04-19
111,"lick, licking, csc, licks, dale",10,2023-04-19
112,"frother, automatic, machine, breville, amazon",5,2023-04-19
113,"hot, 9csm24dtpu, 4dnrqvfmn9, oizxup1rcy, holii",4,2023-04-19
114,"ygobkrngqu, r7jvvlbccv, reverses, oxe, villains",2,2023-04-19
117,"expired, zf6nestpxv, wvy0vozbnr, passport, visa",5,2023-04-19
118,"tiger, upao, mareneyra, inch, chewing",2,2023-04-19
119,"cuckold, pipagolosa, wife, her, andrea",8,2023-04-19
120,"açaí, yiih273ifx, lt43vsnzso, smoothie, bagel",5,2023-04-19
121,"cappuccino, reduced, ever, said, water",1,2023-04-19
122,"war, shake, anyone, morning, coffee",1,2023-04-19
123,"poop, pooping, zh67cfcz5p, jfnbtlxhv3, aljo7ca9xj",7,2023-04-19
124,"banana, bananas, 8qepdobu1o, shells, sprinkled",5,2023-04-19
-1,"milk, and, the, to, co",2072,2023-04-20
0,"the, of, in, production, dairy",239,2023-04-20
1,"coffee, with, milk, drink, morning",165,2023-04-20
2,"pudding, rice, made, mom, make",97,2023-04-20
3,"healthy, lifestyle, diet, health, eating",82,2023-04-20
4,"bad, what, have, people, milk",77,2023-04-20
5,"hit, car, crashed, head, had",69,2023-04-20
6,"goal, enzo, bad, player, team",68,2023-04-20
7,"latte, croissants, matcha, cold, order",72,2023-04-20
8,"chamber, breast, yanira, dyskinesia, hospital",18,2023-04-20
9,"asturian, asturias, certification, tests, language",50,2023-04-20
10,"goal, penalty, hit, beaten, goalkeeper",30,2023-04-20
11,"gay, cum, aporteshots, chavozgayx, lphool921",27,2023-04-20
12,"beat, beats, nothing, beaten, up",32,2023-04-20
13,"lactose, free, intolerant, stomach, whole",46,2023-04-20
14,"chocolate, fresh, chocokrispis, choco, vanilla",33,2023-04-20
15,"cereal, cereals, first, before, comes",28,2023-04-20
16,"almond, coffee, milk, stevia, with",29,2023-04-20
17,"cock, dick, my, semen, cocks",35,2023-04-20
18,"video, onlyfans, videos, subscribe, 2tmix5pk7l",15,2023-04-20
19,"pump, pumping, pumped, who, my",27,2023-04-20
20,"milkshake, selfie, think, having, vanilla",33,2023-04-20
21,"people, bad, are, crap, re",24,2023-04-20
22,"he, neal, his, him, going",23,2023-04-20
23,"condensed, strawberries, zmv6mddjgp, pa6oadzmmp, 1yjfnhs4xv",22,2023-04-20
24,"wants, want, who, give, https",21,2023-04-20
25,"cockroach, rule, scientists, joking, science",41,2023-04-20
26,"shaken, unnoticed, shake, up, shaking",26,2023-04-20
27,"physical, change, surprising, survivors, shocking",28,2023-04-20
28,"shake, protein, weight, makoke, herbalife",32,2023-04-20
29,"cow, cows, calf, flies, vegans",15,2023-04-20
30,"dulce, de, leche, existed, compare",21,2023-04-20
31,"painted, as, cow, bad, is",28,2023-04-20
32,"breast, remark, p6nnrlwlua, dckw9a5sqr, uza3jirti6",9,2023-04-20
33,"mala, leche, la, madre, que",16,2023-04-20
34,"ass, fill, my, little, full",21,2023-04-20
35,"brothers, sisters, brother, sister, doc",30,2023-04-20
36,"leche, stripchat, tu, la, que",18,2023-04-20
37,"her, she, love, ucxsiorpmb, msdhakdjd",19,2023-04-20
38,"ice, cream, dulce, de, leche",19,2023-04-20
39,"dulce, de, leche, 3bozyymy1x, ndetaaa",5,2023-04-20
40,"amazon, moisturizing, camella, tan, chocolates",14,2023-04-20
41,"physical, change, xmar_one, mental, gym",21,2023-04-20
42,"broken, record, records, broke, number",16,2023-04-20
43,"rich, richest, uncle, wxfzzovm0d, cwun3vjnr2",9,2023-04-20
44,"cake, dulce, de, leche, base",6,2023-04-20
45,"con, café, cafe, leche, relaxing",18,2023-04-20
46,"face, fill, mouth, jnf7e80ook, 1ibhsbh44y",15,2023-04-20
47,"fill, fills, filled, with, delicious",16,2023-04-20
48,"powdered, klim, powder, sugar, zsdxs6l4vd",17,2023-04-20
49,"telegram, channel, content, group, subscribe",14,2023-04-20
50,"oats, oat, oatmeal, qlrw0i4ayb, thickens",11,2023-04-20
51,"he, him, smile, coffee, his",13,2023-04-20
52,"6r4c8cfouh, hgnm90smdt, vvzet7dfkb, qjzc6euegr, aurbh0vfqp",19,2023-04-20
53,"out, get, xeqahdmyiz, zb8cf9elqp, k3db92wmeq",16,2023-04-20
54,"hooker, hookers, cdjrncpdie, yznafy4ben, 5lmmva5sbk",8,2023-04-20
55,"tea, wx1rpmt3za, bvaz8lfwyg, kdmimoefyr, 2ctul1mtim",9,2023-04-20
56,"pancakes, dulce, de, leche, characterizes",5,2023-04-20
57,"paddling, dulce, de, leche, paddle",7,2023-04-20
58,"kitten, cat, cats, kittens, kneading",17,2023-04-20
59,"tank, tanks, water, hyunjinontopp, cn6b1ylyiu",9,2023-04-20
60,"as, really, say, cow, bad",17,2023-04-20
62,"birthday, lots, tokischa, your, on",11,2023-04-20
63,"white, whiter, black, color, dark",12,2023-04-20
64,"morning, good, thursday, oc4shwbswb, h3xjetbtel",11,2023-04-20
65,"teeth, baby, tooth, dentist, bambis",16,2023-04-20
66,"tits, fill, 0yimam7txa, desnudoencasa, sheyekzaii",10,2023-04-20
67,"smoothie, green, 1cxwhwu9vb, pinoborer, banana",5,2023-04-20
68,"strawberry, juice, juices, fresh, marinella",8,2023-04-20
69,"dulce, de, leche, spoonful, jar",11,2023-04-20
70,"mood, bad, ilzc7vvemv, ubo10bjy1o, hinterior",8,2023-04-20
71,"cookies, cookie, pbezkutekq, 3brwphrwas, serranos",5,2023-04-20
72,"arroz, con, leche, ya, knwcnjcvnx",9,2023-04-20
73,"jq2l1md6ma, qm9eynjpsu, coating, excess, alfajor",1,2023-04-20
74,"coconut, qha62h7rdh, lullaby, po, deli",4,2023-04-20
75,"salad, pepper, cheese, 5bmmpp5vyg, chickle",5,2023-04-20
76,"croissants, coffee, with, croissant, yyvwpixgjx",14,2023-04-20
77,"twitter, vintage, tweet, tweets, izkwl6tnv2",8,2023-04-20
78,"swallow, swallows, dmhtpvmw3d, 110nakkqg5, 837pucmsom",9,2023-04-20
79,"daddy, xhptc7weot, gmyve7wvu8, 2rie3baqpn, v7ujtabzte",6,2023-04-20
80,"bath, bathe, hotwifecaracas, ardivan1107, oy3ivvfcky",6,2023-04-20
81,"oreo, oreos, kupdupktb4, puoh6pfeku, cookies",8,2023-04-20
82,"argentinian, argentina, dulce, de, leche",7,2023-04-20
83,"churros, dulce, de, leche, jahsj",5,2023-04-20
