Topic,Words,Frequency,Timestamp
24,"wants, who, want, b3veb4pmo1, 5ms6dabjyg",16,2023-05-08
26,"shaken, shakes, shake, unnoticed, shaking",26,2023-05-08
27,"physical, change, molinero, adara, survivors",16,2023-05-08
28,"protein, shake, gaining, muscle, mass",25,2023-05-08
29,"porca, fnglocal, cow, tmb, fniwfnelbe",10,2023-05-08
30,"dulce, de, leche, iag, yokes",17,2023-05-08
31,"painted, as, cow, bad, is",28,2023-05-08
32,"baby, boob, born, vp0rkpm2j4, hoisd0ag5x",11,2023-05-08
33,"mala, leche, que, zhckcphisc, ptvpmppavj",8,2023-05-08
34,"ass, fill, full, my, leave",19,2023-05-08
35,"brothers, brother, sister, sisters, glu",19,2023-05-08
36,"leche, minsan, la, pitiful, po",12,2023-05-08
37,"her, she, quiroga, exciting, lend",17,2023-05-08
38,"ice, cream, dulce, de, leche",14,2023-05-08
39,"dulce, de, leche, anchoa, xl0xzrvdzq",9,2023-05-08
40,"ziaja, amazon, price, miniprecio, champúdelechedecabra",14,2023-05-08
41,"change, physical, mental, ve, months",16,2023-05-08
42,"broken, canyaman, records, record, dedications",12,2023-05-08
43,"rich, how, cxjpcplzqx, ass, husband",15,2023-05-08
44,"cake, dulce, de, leche, cakes",17,2023-05-08
45,"con, café, cafe, leche, rnib",10,2023-05-08
46,"face, fill, mouth, sj0qjob0z0, andreitax",13,2023-05-08
47,"fill, filled, jiwot0zlcw, aranza, niurhaseb9",12,2023-05-08
48,"powdered, powder, wgvmt57okk, liquid, klim",8,2023-05-08
49,"telegram, channel, content, group, videos",10,2023-05-08
50,"oat, oatmeal, oats, wjex6kueq6, uegfhyl7rs",17,2023-05-08
51,"he, coffee, him, she, himeru",10,2023-05-08
52,"ucdv4kwvsi, 9iqvsie0dh, rsxokxfjnt, 7icrhawng3, hahahahahskahss",10,2023-05-08
53,"out, get, k2pd9hlysr, ewqpkmie9b, hu6jlskvvv",17,2023-05-08
54,"hooker, hookers, little, thousand, iiem5k9psp",14,2023-05-08
55,"tea, honey, try, crodk5tnll, 8qoloz2udd",14,2023-05-08
56,"pancakes, dulce, de, leche, sano",6,2023-05-08
57,"paddling, dulce, de, rowing, leche",12,2023-05-08
58,"cat, kitten, andy, cats, existence",7,2023-05-08
59,"tank, water, hot, tanks, pajero",35,2023-05-08
60,"as, really, say, cow, b4ryszam5w",11,2023-05-08
62,"birthday, lots, braid, apology, rape",15,2023-05-08
63,"white, fuylejht7u, 19o6hun3ou, asdzl2tbgs, szppxadsub",9,2023-05-08
64,"sunday, morning, jerkoff, cumming, 1l",11,2023-05-08
65,"teeth, baby, tooth, blocks, ones",11,2023-05-08
66,"tits, grope, them, swollen, pump",11,2023-05-08
67,"smoothie, green, fruit, kmetc4zkgx, deckchair",10,2023-05-08
68,"juice, strawberry, qehm7w6tv8, zhvgxtyeyp, qwi7mocgs8",7,2023-05-08
69,"dulce, de, leche, deliberating, spoonful",6,2023-05-08
70,"mood, bad, kppjkvm7uo, melek, bittori",9,2023-05-08
71,"cookies, xrg81ldtiy, ptm4ccuhlo, weyyy, soak",3,2023-05-08
72,"arroz, con, leche, made, lol",13,2023-05-08
73,"140g, calories, j6nu8tjcxc, yrkbu9wbvv, sugar",2,2023-05-08
74,"coconut, pjnwoyzyg8, 4vmq14ktnu, riwcylw5w0, odw8wuvk7c",4,2023-05-08
75,"olives, empanadas, breakfast, eggs, potatoes",13,2023-05-08
76,"croissants, coffee, stuffed, happiness, trying",4,2023-05-08
77,"twitter, tweets, tweet, pilarggranja, carlossegovia_",8,2023-05-08
78,"swallow, mvawl2pwbg, g573pbttfh, g8tdvtksdr, zadjen2jyj",6,2023-05-08
79,"daddy, voeh5m6t57, mmmmwhat, sdoqmfcpgg, zoxjah72kc",7,2023-05-08
80,"kisiera, knph5rsivk, p4d2uit8hw, kien, bathe",1,2023-05-08
81,"oreo, oreos, 1serpmcu6m, w58pzjc7fm, ingredients",4,2023-05-08
82,"dulce, argentina, argentinian, de, leche",9,2023-05-08
83,"churros, o3pe7w0vv4, friar, dulce, de",3,2023-05-08
84,"much, roymmrviow, 0t3kejcems, bwrqtfhxy8, phoavvoeap",5,2023-05-08
85,"jehovah, jskeks, jsjdiskds, xf1zzstusp, jaskjdakjdska",6,2023-05-08
86,"strawberry, milkshake, kevincosne, aspbhn0ssa, brain",4,2023-05-08
87,"breakfast, xrjn9nfqex, 4s1kl4st4i, vgoyu16uzn, um",5,2023-05-08
88,"lpm, bad, what, lptm, bldo",7,2023-05-08
89,"smell, smells, ufcol6ph2s, nenzu6fiay, vubbpv9llu",7,2023-05-08
90,"rt, cocktail, jets, give, if",10,2023-05-08
91,"sirens, drink, from, leche, of",1,2023-05-08
92,"soy, cacota, lifted, offices, liter",7,2023-05-08
93,"eux7jbdcjp, 6wsndrqw9z, mecagoen, mvquuhogds, eignoyblqu",5,2023-05-08
94,"bb, wherever, kisses, mmm, mommy",3,2023-05-08
95,"cheese, cheeses, sheep, goat, raw",8,2023-05-08
96,"sleep, glass, bed, go, b36b8pedey",8,2023-05-08
97,"bread, dough, khaotung, bk90mbp1pd, 5mtn0ezecv",4,2023-05-08
98,"ambar, ppppffff, sbwlepmntu, corncob, eggs",1,2023-05-08
99,"yogurt, lpqmp, 3lwdzlo4ii, gwejjc4o1t, rfqzmab8l4",3,2023-05-08
100,"bread, toast, dulce, de, leche",6,2023-05-08
101,"marcos, annihilating, zrtt03fzpx, pit0, sbfi577udm",4,2023-05-08
102,"riber, bro, cold, haha, glass",2,2023-05-08
103,"kill, myself, objectively, monstrous, choke",28,2023-05-08
104,"ravages, speck, ruined, drug, whole",3,2023-05-08
105,"she, her, his, showed, uefz418vg0",5,2023-05-08
106,"spilled, cry, crying, over, cries",9,2023-05-08
107,"drink, diarrhea, yuiz6aqwhr, t3savq2jmg, blstz5szvh",8,2023-05-08
108,"rico, komtejzrou, hq3nmu8oyf, 70rt, yvczku4vm4",5,2023-05-08
109,"watchin, uxyfmtvfwi, undfsk1zuc, llené, friiiitoooo",3,2023-05-08
110,"refrigerator, went, candies, emperador, bathroom",1,2023-05-08
111,"lick, l7u9xwovlw, yuax3w9oag, vofg7xtvcn, purging",3,2023-05-08
112,"frother, vfc109x, primalatte, automatic, breville",2,2023-05-08
113,"hot, ahyvple6dg, 6cftzta3us, 5q2ie4c8db, csobdamgko",6,2023-05-08
114,"plot, opera, soap, blah, lpvvy6ioxh",6,2023-05-08
115,"butter, dulce, de, leche, peanut",26,2023-05-08
117,"expired, preparation, buvzcp08a0, rgbiqipsyg, guess",5,2023-05-08
118,"tiger, ahem, random, usually, crave",2,2023-05-08
119,"cuckold, penetrate, her, wife, hotwife",9,2023-05-08
120,"açaí, shaken, rarity, açai, antônio",5,2023-05-08
121,"cappuccino, antoninos, fpybfiyesf, soy, plis",6,2023-05-08
122,"shaken, saved, coffee, taste, does",2,2023-05-08
123,"poop, pooping, corrupt, v1zg7whypd, v1zg7wi6el",6,2023-05-08
-1,"milk, and, to, https, co",2133,2023-05-09
0,"the, of, in, production, farmers",206,2023-05-09
1,"coffee, with, milk, drink, day",150,2023-05-09
2,"rice, pudding, elgrancheffamosos, pasta, made",130,2023-05-09
3,"healthy, lifestyle, habits, diet, coe",80,2023-05-09
4,"bad, what, people, have, milk",73,2023-05-09
5,"hit, crashed, car, had, head",59,2023-05-09
6,"madrid, bad, player, he, they",64,2023-05-09
7,"latte, matcha, vanilla, order, croissants",48,2023-05-09
8,"torredeurgenciaskennedy, preterm, breast, hospitalized, bogotá",59,2023-05-09
9,"asturian, asturias, asturiana, oviedo, diocese",38,2023-05-09
10,"team, galdino, beaten, penalty, goal",18,2023-05-09
11,"gay, cumtribute, cum, rt, hentaicumtribute",42,2023-05-09
12,"beat, nothing, beats, beaten, up",38,2023-05-09
13,"lactose, free, intolerant, stomach, belly",40,2023-05-09
14,"chocolate, fresh, vanilla, chocomilk, milk",47,2023-05-09
15,"cereal, first, cereals, then, because",28,2023-05-09
16,"almond, tesispucp, openaccess, accesoabierto, milk",38,2023-05-09
17,"dick, cock, my, cocks, want",25,2023-05-09
18,"video, videos, rt, full, regular",29,2023-05-09
19,"pump, pumping, pumped, my, who",26,2023-05-09
20,"milkshake, palmao, logic, having, hamburger",25,2023-05-09
21,"people, bad, envious, so, who",24,2023-05-09
22,"he, his, him, milk, all",26,2023-05-09
23,"condensed, sweet, eat, milk, strawberries",25,2023-05-09
24,"wants, roier, badboy, want, soooo",21,2023-05-09
26,"shaken, shake, unnoticed, up, shaking",27,2023-05-09
27,"physical, change, estefan, dayanara, lili",21,2023-05-09
28,"shake, protein, weight, lose, muscle",25,2023-05-09
29,"cow, jflafaurie, fedegan, calves, cows",16,2023-05-09
30,"dulce, de, leche, evermore, granized",21,2023-05-09
31,"painted, as, cow, bad, is",19,2023-05-09
32,"baby, breast, mother, mom, boticaria",23,2023-05-09
33,"mala, rudiger, leche, rudiguer, 16rqoh0nxc",8,2023-05-09
34,"ass, fill, my, comes, nearby",15,2023-05-09
35,"brothers, brother, sisters, sister, ea7zaq1nr9",27,2023-05-09
36,"leche, tranquillo, bébase, su, pr0zodjphg",21,2023-05-09
37,"she, her, dog, lebroonnnnn, fpndsfrrqi",17,2023-05-09
38,"ice, cream, dulce, de, leche",11,2023-05-09
39,"dulce, de, leche, qpyhtbcntk, 0vns0co34s",7,2023-05-09
40,"vat, unit, 05, 59, 09",12,2023-05-09
41,"change, physical, kbhv3szdoz, hk91kbrcx6, elev8factorygym",9,2023-05-09
42,"record, broken, hours, qnd, dsd",14,2023-05-09
43,"rich, mmmmgh, how, ass, his",18,2023-05-09
44,"cake, dulce, de, leche, cakes",12,2023-05-09
45,"con, café, cafe, leche, plaza",21,2023-05-09
46,"face, mouth, fill, yhkesn1vrj, 42lmrwcrx4",13,2023-05-09
47,"fill, cola, filled, with, able",13,2023-05-09
48,"powdered, klim, lalo, sugar, eaten",19,2023-05-09
49,"telegram, channel, group, encuentrogaymty, content",17,2023-05-09
50,"oat, oatmeal, oats, jskjs, fw36h7pkws",17,2023-05-09
51,"he, him, his, coffee, tya",9,2023-05-09
52,"tadwlwsdhn, jzhdjaja, wxl8uvy78x, vqvo74bgrr, uzpmhxdmqf",11,2023-05-09
53,"get, out, 4a7vaburu9, zgjowjevye, rmx",10,2023-05-09
54,"hooker, hookers, little, pictures, thousand",10,2023-05-09
55,"tea, evaporated, tglqizzxa1, f4x369shhh, kpkg3r1b81",10,2023-05-09
56,"pancakes, dulce, de, leche, fooerte",8,2023-05-09
57,"paddling, paddle, dulce, de, leche",9,2023-05-09
58,"cat, kitten, kittens, cats, solnaveira",8,2023-05-09
59,"tank, tanks, water, heater, hot",23,2023-05-09
60,"as, really, say, cow, bad",15,2023-05-09
62,"birthday, lots, your, on, tokisha",12,2023-05-09
63,"white, whiter, ejdooah50r, ffq8d67bvr, 6zwqclr0mi",10,2023-05-09
64,"morning, good, trvgo8byfu, lhivy6fssf, zz7xwlccvp",11,2023-05-09
65,"teeth, tooth, baby, finalspaceau, sheryl",8,2023-05-09
66,"tits, big, them, bhz42x1mpn, dzzblpnxq7",10,2023-05-09
67,"smoothie, blueberry, banana, qcsljnc3js, v2vxqoifvt",10,2023-05-09
68,"dann, strawberry, brought, love, how",2,2023-05-09
69,"dulce, spoonful, de, leche, jar",10,2023-05-09
70,"mood, bad, leather, dorukhermanos_, berkhermanos",12,2023-05-09
71,"cookies, 9apas3dxoa, 5hn1ae1mj3, cataphized, trojan",3,2023-05-09
72,"arroz, con, fco4boltnj, 3lanes, freeway",4,2023-05-09
73,"malt, composition, octagons, labeling, extremely",1,2023-05-09
74,"coconut, riqui, cksxwgi5sw, dlqhmdmuac, 15uydhn6nr",10,2023-05-09
75,"unsalted, cheese, crackers, uypsyldvtj, 9vq0c3ea4u",5,2023-05-09
76,"croissants, coffee, 7zwkyky0jv, lanvvgwa2i, croissant",7,2023-05-09
77,"twitter, tweets, tweet, hys02hnqc2, hh9i5qhevd",9,2023-05-09
78,"swallow, swallowing, y4ccsnydto, ozjrd5omb9, wiayjf2uck",6,2023-05-09
79,"daddy, k44idkglwv, sisiisi, yhau1agkik, 9yz7q6iwrs",6,2023-05-09
80,"bathe, shower, bath, i4k6vqw0kg, hfw4kzrmze",10,2023-05-09
81,"oreo, oreos, trick, upbihp7yqd, tochoooo",8,2023-05-09
82,"argentina, argentinian, uruguayan, dulce, de",6,2023-05-09
83,"churros, dulce, churro, chuchuchu, de",9,2023-05-09
84,"much, ty9geriwos, 3mvnpgzhva, xdffkig75w, 6chgssjxna",7,2023-05-09
85,"chapis, jsajsajsajs, ajsjsj, wzvdh26xba, pzek20npok",4,2023-05-09
86,"strawberry, milkshake, 1gxtzjgndp, f8bposautn, pinkiegalax1",9,2023-05-09
87,"breakfast, hm36zphqwm, ewdj5q3xnx, y1tno1k9jf, vampires",5,2023-05-09
88,"lpm, bad, what, paddle, haais5mknq",10,2023-05-09
89,"smell, smells, scent, rancid, like",12,2023-05-09
90,"rt, jihmnbhng2, vz6ykqrpdy, 5zzwx1tcvx, ydm8iz4nn9",4,2023-05-09
91,"siren, drink, from, leche, sirens",1,2023-05-09
92,"soy, fart, tastes, bought, want",2,2023-05-09
93,"deli, delicious, ey1yy0fteq, oa91tyoe28, l6eenjdboq",5,2023-05-09
94,"bb, wherever, kisses, mommy, favorite",4,2023-05-09
95,"cheese, cheeses, sheep, texture, marsan",10,2023-05-09
96,"bed, sleep, before, glass, reactor105",6,2023-05-09
97,"bread, 6jzmnozvdt, mqeqja5ssg, ahahahahaha, grocery",3,2023-05-09
98,"eggs, egg, euo1t0z0so, 7kgebqtkoe, vhd0xpftua",6,2023-05-09
99,"yogurt, fermenting, yogurcasero, nn2sxjym2s, padano",4,2023-05-09
100,"bread, butter, dulce, de, leche",10,2023-05-09
101,"marcos, julieta, harassment, her, romina",7,2023-05-09
102,"glass, cold, 90y5unjyyj, jd3vlmsupu, 7jmnu0ofmh",7,2023-05-09
103,"kill, myself, objectively, monstrous, choke",10,2023-05-09
104,"thats, drink, rancid, watermelon, drinking",7,2023-05-09
105,"his, her, he, nipples, udder",10,2023-05-09
106,"spilled, cry, over, crying, expelled",9,2023-05-09
107,"drink, x39rqt4qqq, vifi5gucez, wvl9s8f0a6, ddvbqircjg",5,2023-05-09
108,"rico, repeats, g03ahvzdb3, q922e28ymq, breaths",4,2023-05-09
109,"así, gusta, lo, le, promo",5,2023-05-09
110,"were, detail, nightgown, awelas, virgada",5,2023-05-09
111,"lick, bc7yirhqi3, ke3rlm5zdn, gdaix0w73m, ldaypd1nio",4,2023-05-09
112,"frother, maker, breville, integrated, amazon",7,2023-05-09
113,"uedbk97ebp, daanxgyqdh, hot, aaaaa, encuentrogaymty",2,2023-05-09
114,"kkkkkkkk, plot, fraser, jup5bbeqft, weisz",5,2023-05-09
115,"butter, l09ujemrmx, cczc66yeyd, ynb3xybyrv, lvr8tmvs8z",5,2023-05-09
117,"expired, expiration, jkrk3migk2, snwabbnncv, bt3to9zbhd",7,2023-05-09
118,"tiger, mñn, eden, faith, girl",2,2023-05-09
119,"cuckold, creampie, grxnlvxefa, xqrn0j2ul9, qgpdzejzev",3,2023-05-09
120,"açaí, passion, 6qe4q8cxkk, confetti, guarana",4,2023-05-09
121,"frappuccino, y5z8c3c2ny, fsi92gszwo, capuccino, frog",4,2023-05-09
122,"shake, shaken, starbucks, coffee, cora",4,2023-05-09
123,"poop, gwuxkyaqm6, mqh2k2ngrk, n8sxglvksv, hajsjs",3,2023-05-09
124,"banana, bananas, buttermilk, 5pvsoo6k4f, 02ujmjpfki",3,2023-05-09
-1,"and, milk, to, the, co",2023,2023-05-10
0,"puleva, production, farmers, of, covap",244,2023-05-10
1,"coffee, with, milk, sugar, or",144,2023-05-10
2,"pudding, rice, mom, made, he",96,2023-05-10
3,"healthy, diet, lifestyle, eating, life",105,2023-05-10
4,"bad, people, what, milk, envious",86,2023-05-10
5,"hit, car, crashed, she, had",56,2023-05-10
6,"barriola, bad, player, basketball, play",125,2023-05-10
7,"latte, matcha, ordered, myself, croissants",61,2023-05-10
8,"breast, breastfeeding, bank, donation, babies",40,2023-05-10
9,"asturian, asturias, healthcare, asturiana, the",55,2023-05-10
10,"penalty, flamengo, beaten, team, corinthians",35,2023-05-10
11,"gay, cum, cumtribute, rt, encuentrogaymty",54,2023-05-10
12,"beat, beats, nothing, beaten, kkkkkkkk",24,2023-05-10
13,"lactose, free, intolerant, whole, stomach",43,2023-05-10
14,"chocolate, fresh, vanilla, chocomilk, chocokrispis",27,2023-05-10
15,"cereal, cereals, first, before, put",31,2023-05-10
16,"almond, coffee, milk, tastes, cdfbc96p1c",34,2023-05-10
17,"cock, dick, suck, hard, my",23,2023-05-10
18,"video, rt, videos, upload, see",35,2023-05-10
19,"pump, pumping, pumped, my, egrwl3oqvm",34,2023-05-10
20,"milkshake, having, chocolate, rwbmj4spmh, vanillaaaaaa",32,2023-05-10
21,"bad, people, person, envious, be",28,2023-05-10
22,"he, his, him, has, permission",20,2023-05-10
23,"condensed, natulac, strawberries, eat, multiple",20,2023-05-10
24,"want, wants, https, co, ygiex6cqwb",22,2023-05-10
26,"shaken, shake, shaking, shakes, unnoticed",24,2023-05-10
27,"physical, change, after, island, recognize",14,2023-05-10
28,"shake, protein, weight, replacement, vitamines",25,2023-05-10
29,"cow, cows, dairy, sensory, fedegan",19,2023-05-10
30,"dulce, de, leche, koletas, crismorena",19,2023-05-10
31,"painted, as, cow, bad, is",16,2023-05-10
32,"moms, baby, father, mother, breast",32,2023-05-10
33,"mala, barriola, leche, que, chapter",20,2023-05-10
34,"ass, fill, want, 3e3qbnqn6h, v7mbnkji4h",16,2023-05-10
35,"brothers, sisters, brother, same, sister",28,2023-05-10
36,"leche, wrestlers, asada, personas, batar",15,2023-05-10
37,"her, she, give, 6xttfuy4p8, p5vjwoj0fp",17,2023-05-10
38,"ice, cream, dulce, de, leche",16,2023-05-10
39,"14wtusnsio, m7s32ivco1, strudel, diariosevilla, eng",2,2023-05-10
40,"amazon, ml, body, hjoaejcxsn, liutaqfho4",7,2023-05-10
41,"physical, change, gym, mental, proud",19,2023-05-10
42,"record, broken, records, broke, freak",12,2023-05-10
43,"rich, how, ass, cock, his",13,2023-05-10
44,"cake, dulce, de, leche, f1",8,2023-05-10
45,"con, café, cafe, isma, leche",9,2023-05-10
46,"face, mouth, fill, your, my",17,2023-05-10
47,"fill, filled, fills, with, ready",15,2023-05-10
48,"powdered, eat, sugar, f9qxnz5aae, mxels8bue0",16,2023-05-10
49,"telegram, channel, group, content, full",23,2023-05-10
50,"oat, oatmeal, oats, cinnamon, sujlw5rsc4",15,2023-05-10
51,"he, sakuya, smile, milkshake, his",10,2023-05-10
52,"e9zqgd8ig6, 1xsi4s2krx, wfxkojrbz4, 3cpb7enoml, ayacpkhwzl",11,2023-05-10
53,"out, get, come, aauxjp9a5p, aguscocina",10,2023-05-10
54,"hooker, hookers, her, little, she",18,2023-05-10
55,"tea, rimco, gurl, cooked, josué",10,2023-05-10
56,"pancakes, dulce, de, leche, wgxtli0x1n",11,2023-05-10
57,"paddling, paddle, dulce, pastry, de",7,2023-05-10
58,"cat, kitten, tuna, cats, bunny",8,2023-05-10
59,"tank, tanks, water, heater, hot",14,2023-05-10
60,"as, really, say, cow, bad",13,2023-05-10
61,"pasteurized, 59guynugfi, skimmed, values, calories",1,2023-05-10
62,"birthday, lots, on, your, 12th",19,2023-05-10
63,"white, whiter, color, tan, black",13,2023-05-10
64,"dlg2kigemb, dkuzi7fvth, webosdehombre, roqolxggm5, fssf9a1bjr",6,2023-05-10
65,"teeth, baby, tooth, decay, dental",7,2023-05-10
66,"tits, men, busty, nipples, big",9,2023-05-10
67,"smoothie, enhypen, blueberry, jungwon, satoori",18,2023-05-10
68,"strawberry, strawberries, miskisimoo, gtqhzbfnqd, 7u7r",8,2023-05-10
69,"dulce, de, leche, jar, spoonful",10,2023-05-10
70,"mood, bad, hate, tkhw6svwie, oroax10vaz",12,2023-05-10
71,"cookies, cpeplo6nuj, principe_es, f6jpukzp6i, ducal",14,2023-05-10
72,"arroz, con, leche, dishes, o4vlbmvd3i",10,2023-05-10
73,"6a61jlwy6r, repealing, law, 170, proposing",1,2023-05-10
74,"coconut, camu, tried, foodconfort, 1xy9zwxvn1",10,2023-05-10
75,"meat, egg, cannelloni, eat, avocado",8,2023-05-10
76,"croissants, coffee, croissant, du42lbg4on, umagalvann",10,2023-05-10
77,"twitter, tweet, tweets, twitters, wednesday",13,2023-05-10
78,"pvarrkrz4i, q3jjzwdbhp, swallow, phew, delicious",2,2023-05-10
79,"daddy, ycqsx2lqw6, wxecnearzr, qhmfesxygm, ofgswsuoq9",4,2023-05-10
80,"bathe, bath, unseph5ad9, lpj1gczac1, e99wzi4qvb",5,2023-05-10
81,"oreo, oreos, options, l6nf1jwe4r, bodyoooooiio",8,2023-05-10
82,"argentinian, dulce, de, argentina, py5bb93wfk",6,2023-05-10
83,"churros, dulce, de, leche, iyvstq2nal",7,2023-05-10
84,"much, cqfr5cuq6n, cuycadmruz, wksm7cgmpy, jreqhjtw3p",6,2023-05-10
85,"jssjsksk, c0npzwjq8d, jajajajajajajajajajajajajajajaj, jajsjdjfkd, jrsgjgs",5,2023-05-10
86,"strawberry, milkshake, fdket7ocxy, jakskskdk, jrx7twqxpm",8,2023-05-10
87,"breakfast, u8ib2cfl6l, oazzaaodz8, dsbbzav22h, peczkuk5rq",6,2023-05-10
88,"lpm, bpm, bad, vl7zqsguy4, y1vajqmxzp",8,2023-05-10
89,"smell, smells, debatbcnrtve, hfrfqil49n, tram",6,2023-05-10
90,"wzau5l1b5c, bffc6nqj19, rt, fill, ll",2,2023-05-10
91,"sirens, mondoguito, ultdvihmtd, xdozr7dmac, verse",2,2023-05-10
92,"soy, wait, live, shops, cafeteria",12,2023-05-10
93,"delicious, e58ks8bidq, chamomalasana, iments, ilets",7,2023-05-10
94,"bb, wherever, kisses, mommy, mmm",5,2023-05-10
95,"cheese, cheeses, sheep, finca, cured",5,2023-05-10
96,"sleep, xixrbdsawt, 3z5tis3hgv, u6tyhqlszl, ease",4,2023-05-10
97,"bread, roses, recipe, yeast, mixer",10,2023-05-10
98,"eggs, egg, 0xcjkrlgla, heiq0kmz9r, vcgs4ij5ng",5,2023-05-10
99,"yogurt, i1wc0h5ix6, xnsmrz9ank, tqijab3eyx, enjoydairy",4,2023-05-10
100,"toast, crunch, bread, butter, dulce",5,2023-05-10
101,"marcos, julieta, safa, surprised, tank",5,2023-05-10
102,"cold, u3xpkfaoyr, 8bly2t5ak4, hinvsxdftx, piñalim",5,2023-05-10
103,"kill, myself, pudding, rice, want",8,2023-05-10
104,"lesson, contain, learned, whole, again",2,2023-05-10
105,"his, her, blonde, he, she",7,2023-05-10
106,"spilled, cry, over, crying, repudiated",5,2023-05-10
107,"wxzp7yp7rq, knqoy0oclx, xtgeg4kj2d, 41jq9ye2bz, fvb8nznubf",4,2023-05-10
108,"rico, 81f0evqdy1, npqpecrqj5, erciwase0p, mzqw3pvhlg",4,2023-05-10
109,"pones, 7eow4deynu, rodilla, gokjc9g3ho, sacarme",2,2023-05-10
110,"me, bed, cafeteria, zahira, pinguin",8,2023-05-10
111,"licking, lick, bprc0byogx, lickbuddy, u5i1dbnw13",5,2023-05-10
112,"frother, superautomatic, maker, amazon, electric",9,2023-05-10
113,"hot, vvgayynt5i, 86bdymwzu0, 88tjotcnj2, 8q6vmxlkno",6,2023-05-10
114,"lovers, omg, beaten, plot, 26489",6,2023-05-10
115,"butter, combination, gzjwosuumr, enegqok56l, ferrol360",4,2023-05-10
117,"expired, pum, ahr7gvorpv, k3nw5lytgh, expires",8,2023-05-10
118,"tiger, sibles, tuosocaliente, freenbeckys, 3uvvzjy9nc",6,2023-05-10
119,"cuckold, wife, 2xnyqxtz6k, 3vi0pcpqmb, ofkkwfou3z",4,2023-05-10
120,"açaí, larica, depresses, tuco, unlocked",5,2023-05-10
121,"cappuccino, maccha, soy, 1jpafyqzch, 0w1h7ctza3",5,2023-05-10
122,"shaken, coffee, kghr4qdtto, worldoo, shaked",5,2023-05-10
123,"poop, pooping, gachupins, wwex3xtbhk, 3uqtt57izh",6,2023-05-10
124,"banana, bananas, deli, halsjskkss, ovlha0cvid",8,2023-05-10
-1,"and, milk, to, the, https",1930,2023-05-11
0,"price, production, in, of, the",249,2023-05-11
1,"coffee, with, drink, milk, without",142,2023-05-11
2,"pudding, rice, made, mom, cinnamon",87,2023-05-11
3,"healthy, lifestyle, diet, eating, life",85,2023-05-11
4,"bad, people, have, milk, what",80,2023-05-11
5,"hit, crashed, car, she, had",75,2023-05-11
6,"bad, boca, player, club, what",34,2023-05-11
7,"latte, matcha, warm, croissants, breakfast",61,2023-05-11
8,"breast, babies, bank, mothers, donation",39,2023-05-11
9,"asturian, asturias, the, its, in",43,2023-05-11
10,"penalty, dourado, beaten, bruno, taken",233,2023-05-11
11,"gay, nsfwtwt, cumtribute, cum, nsfwtw",42,2023-05-11
12,"beat, beats, nothing, tunts, beaten",30,2023-05-11
13,"lactose, free, intolerant, stomach, whole",33,2023-05-11
14,"chocolate, fresh, chocomilk, vanilla, craved",22,2023-05-11
15,"cereal, cereals, first, put, torreznos",29,2023-05-11
16,"almond, coconut, almonds, milk, coffee",31,2023-05-11
17,"cock, dick, suck, thick, my",30,2023-05-11
18,"video, videos, rt, 9clgghuesa, see",28,2023-05-11
19,"pump, pumping, someone, my, pumped",24,2023-05-11
20,"milkshake, having, going, suffering, vanilla",35,2023-05-11
21,"people, bad, person, are, vibes",28,2023-05-11
22,"he, his, him, man, out",26,2023-05-11
23,"condensed, wafer, delicacies, milk, k1kioxwym8",20,2023-05-11
24,"wants, want, who, give, https",22,2023-05-11
26,"shaken, shake, unnoticed, shakes, shaking",22,2023-05-11
27,"physical, change, nadal, nikocado, nicholas",6,2023-05-11
28,"shake, protein, weight, mercadona, lose",22,2023-05-11
29,"cow, cows, jflafaurie, fedegan, neivapl",20,2023-05-11
30,"dulce, de, leche, vir, trapkitty",20,2023-05-11
31,"painted, as, cow, bad, is",26,2023-05-11
32,"baby, breast, mom, mother, child",25,2023-05-11
33,"mala, leche, que, bitch, glrrr",16,2023-05-11
34,"ass, fill, break, your, want",15,2023-05-11
35,"brothers, brother, sisters, sister, oax4iofzyd",19,2023-05-11
36,"leche, awo, plan, mi, play",24,2023-05-11
37,"she, her, https, co, milk",27,2023-05-11
38,"ice, cream, dulce, de, leche",23,2023-05-11
39,"dulce, de, leche, agrvbbfvwp, glil7meso6",6,2023-05-11
40,"amazon, ml, skin, chocolate, coupon",9,2023-05-11
41,"change, physical, mental, months, so",20,2023-05-11
42,"record, broken, openciba3x3, crash, svzqwnxia0",7,2023-05-11
43,"rich, xmvqhtlh36, truntuyvu6, lxluplvs94, 8hryt95unq",12,2023-05-11
44,"cake, dulce, de, fried, leche",14,2023-05-11
45,"con, café, cafe, leche, dos",15,2023-05-11
46,"face, mouth, pndegdvgpg, ldowo84jnh, o7jlqg933t",11,2023-05-11
47,"fill, filled, with, n5ggp8j60o, wfxrbfqkac",15,2023-05-11
48,"powdered, cherry, sugar, owwufii2y4, 7jz1wjdtjs",19,2023-05-11
49,"telegram, channel, group, dm, zkuurd9s74",10,2023-05-11
50,"oat, oatmeal, oats, nwyrsmyeea, 3xagi8zwou",14,2023-05-11
51,"he, brief, him, couple, coffee",10,2023-05-11
52,"quelitas, eaezwunitq, cbgmcy32kf, p2eph7w0vf, majia",13,2023-05-11
53,"get, out, wqhzhfcojb, 6zumusvqar, apc4bec0vq",12,2023-05-11
54,"hooker, her, little, okywyidfcm, tiocachondo",8,2023-05-11
55,"tea, fwhy6at905, piggio, rohgysfimt, 2rh3fysxi9",9,2023-05-11
56,"pancakes, dulce, de, leche, zeosrspfhq",8,2023-05-11
57,"paddling, paddle, dulce, de, leche",14,2023-05-11
58,"cat, kitten, kittens, cats, she",15,2023-05-11
59,"tank, tanks, water, heater, hot",15,2023-05-11
60,"as, really, say, cow, bad",8,2023-05-11
62,"birthday, lots, your, on, tokischa",15,2023-05-11
63,"white, whiter, color, colored, skin",13,2023-05-11
64,"morning, good, wake, z75qvdkn1c, morym2ecud",10,2023-05-11
65,"teeth, baby, tooth, lq131yqynz, yrw8ly5d0k",6,2023-05-11
66,"tits, fill, gvvw0g7dj7, h0kbo37ogf, x3sdb5sxkm",10,2023-05-11
67,"smoothie, green, fruit, banana, man86lrdn4",8,2023-05-11
68,"strawberry, juice, precdwtpw8, nkfwfjaq7h, stand",7,2023-05-11
69,"dulce, spoonful, de, jar, leche",6,2023-05-11
70,"mood, wobvlfcw6w, prece, jskskdjdjs, s61burxpy7",4,2023-05-11
71,"cookies, yacson, m57d6cikjv, i7rveiask7, maikel",10,2023-05-11
72,"arroz, con, gazo, paw, leche",7,2023-05-11
73,"n1xml1ni71, morphs, sugar, application, label",2,2023-05-11
74,"coconut, 00, 33, topogigios, ewnar1cpu3",8,2023-05-11
75,"peppers, tomatoes, herbs, onions, stuffed",7,2023-05-11
76,"croissants, coffee, croissant, snack, csdut6scqi",8,2023-05-11
77,"twitter, tweet, tweets, 40xsev5ttu, 0y4liazux2",10,2023-05-11
78,"swallow, swallowing, 2ezbfunq1n, miacizbhux, w0eorbviqc",10,2023-05-11
79,"daddy, x9s4czzy0u, aaj3ct7tv8, telepathically, 3m8712mwgv",6,2023-05-11
80,"bath, bathe, o01ivfaixw, n1q2uny9ll, boiler",4,2023-05-11
81,"oreo, cookies, oreos, qiqeyusrbz, xkxygm6bql",8,2023-05-11
82,"argentinian, argentina, dulce, de, team",9,2023-05-11
83,"churros, churro, dulce, friar, de",8,2023-05-11
84,"much, tm7f1plhso, fm7tm6hktq, jcrchbebn4, wgmhehi1ry",7,2023-05-11
85,"jskajs, celu, breaking, finished, brother",1,2023-05-11
86,"strawberry, milkshake, liejtmty7v, ursula, patricio",8,2023-05-11
87,"breakfast, boss, maxi, morning, xjp15xzjda",12,2023-05-11
88,"lpm, bad, gxpvzjyq8u, nkbhp2w3qh, ascidity",9,2023-05-11
89,"smell, smells, enktpknzye, gratitud, 8etcf9oxi6",7,2023-05-11
90,"rt, 4cjjhsb12z, mwc1wefh4b, 1ddw8pnt49, bjm1c3q4gf",4,2023-05-11
91,"2rvtrri5mk, ordinary, plot, sirens, consume",1,2023-05-11
